Title,ReleaseYear,Locations,FunFacts,ProductionCompany,Distributor,Director,Writer,Actor1,Actor2,Actor3
Copycat,1995,Sound Factory (1st and Harrison Streets),null,Regency Enterprises,Warner Bros. Pictures,Jon Amiel,Ann Biderman,Sigourney Weaver,Holly Hunter,null
Chance- Season 1 ep103,2016,878-898 Chestnut St.,null,TVM Productions,HULU,Michael Lehmann,Kem Nunn,Hugh Laurie,Gretchen Mol,Ethan Suplee
Looking,2014,2000 Folsom,null,"Mission Street Productions, LLC",Home Box Office (HBO),Andrew Haigh,Michael Lannan,Jonathan Groff,Frankie J. Alvarez,Murray Bartlett
Pacific Heights,1990,Chinatown,"First established in the mid-19th Century, SF's Chinatown is the oldest and largest Chinatown in the US.",Morgan Creek Productions,Twentieth Century Fox Film Corporation,John Schlesinger,Daniel Pyne,Melanie Griffith,Matthew Modine,null
The Last Black Man in San Francisco,2019,Nevada St btwn Cortland and Jarboe Ave,null,"LBMISF, LLC",A25,Joe Talbot,"Joe Talbot, Jimmie Fails, Rob Richert",Jimmie Fails,Jonathan Majors,Danny Glover
Blue Jasmine,2013,2915 16th St.,null,Perdido Productions,Sony Pictures Classics,Woody Allen,Woody Allen,Cate Blanchett,Alec Baldwin,Peter Sarsgaard
The Game,1997,Harrison Street (The Embarcadero),null,Polygram Filmed Entertainment,Polygram Filmed Entertainment,David Fincher,John Brancato,Michael Douglas,Sean Penn,Deborah Kara Unger
The Dead Pool,1988,Pierce & California Streets (Pacific Heights),null,Warner Bros. Pictures,Warner Bros. Pictures,Buddy Van Horn,Harry Julian Fink,Clint Eastwood,Liam Neeson,Patricia Clarkson
Chance - Season 1 ep105,2016,"State Garage, 818 Leavenworth",null,TVM Productions,HULU,Victoria Morrow,Roxann Dawson,Hugh Laurie,Gretchen Mol,Ethan Suplee
The Bachelor,1999,Columbus Avenue at Green & Stockton,null,George Street Pictures,New Line Cinema,Gary Sinyor,Steve Cohen,Chris O'Donnell,Renee Zellweger,null
Sweet November,2001,Marquee Lofts (1000 Van Ness Avenue at Alice B. Toklas Place),null,Warner Bros. Pictures,Warner Bros. Pictures,Pat O'Connor,Paul Yurick,Keanu Reeves,Charlize Theron,null
Sweet November,2001,Hotel Majestic (1500 Sutter Street),null,Warner Bros. Pictures,Warner Bros. Pictures,Pat O'Connor,Paul Yurick,Keanu Reeves,Charlize Theron,null
Sweet November,2001,"Foote, Cone & Belding (733 Front Street at Pacific)","The building is called ""Jabe & Dunne Advertising Agency"" in the movie.",Warner Bros. Pictures,Warner Bros. Pictures,Pat O'Connor,Paul Yurick,Keanu Reeves,Charlize Theron,null
Sweet November,2001,Farley's Café (1315 18th Street Near Missouri),null,Warner Bros. Pictures,Warner Bros. Pictures,Pat O'Connor,Paul Yurick,Keanu Reeves,Charlize Theron,null
Sweet November,2001,Citicorp Center (1 Sansome Street at Sutter) ,null,Warner Bros. Pictures,Warner Bros. Pictures,Pat O'Connor,Paul Yurick,Keanu Reeves,Charlize Theron,null
Sweet November,2001,Christopher's Books (1400 18th Street),null,Warner Bros. Pictures,Warner Bros. Pictures,Pat O'Connor,Paul Yurick,Keanu Reeves,Charlize Theron,null
Sweet November,2001,Chrissy Field,Chrissy Field was originally an airfield for the Presidio Army Base. ,Warner Bros. Pictures,Warner Bros. Pictures,Pat O'Connor,Paul Yurick,Keanu Reeves,Charlize Theron,null
Sweet November,2001,Blooms Saloon (18th Street between Missouri and Texas Streets),null,Warner Bros. Pictures,Warner Bros. Pictures,Pat O'Connor,Paul Yurick,Keanu Reeves,Charlize Theron,null
Sweet November,2001,Mission Dolores Park (Mission District),"The two land plots that comprise the Park were used as a Jewish cemetery until 1894 when San Francisco prohibited all burials within city limits. The graves were moved to Colma, CA.",Warner Bros. Pictures,Warner Bros. Pictures,Pat O'Connor,Paul Yurick,Keanu Reeves,Charlize Theron,null
Swing,2003,Broadway Studios (435 Broadway at Montgomery Street),null,unlisted,Crazy Dreams Entertainment,Martin Guigui,Mary Keil,Constance Brenneman,null,null
Swing,2003,Regency Building (1290 Sutter Street),null,unlisted,Crazy Dreams Entertainment,Martin Guigui,Mary Keil,Constance Brenneman,null,null
American Graffiti,1973,"Mel's Drive-In (Corner of Van Ness & Mission Street, Mission District)",This restaurant location was demolished; however another Mel's was reopened in 1986 on 3355 Geary Blvd.,Universal Pictures,Universal Pictures',George Lucas,George Lucas,Richard Dreyfuss,Ron Howard,Paul Le Mat
"Murder in the First, Season 2",2015,Stevenson Alley,null,Turner North Center Productions,Turner Network Television (TNT),Steven Bochcho,Eric Lodal,Taye Diggs,Kathleen Robertson,Ian Anthony Dale
Edtv,1999,"Center for the Arts, Yerba Buena Gardens (701 Mission Street)",null,Imagine Entertainment,MCA / Universal Pictures,Ron Howard,Lowell Ganz,Matthew McConaughey,Jenna Elfman,null
Terminator - Genisys,2015,16th and Utah,"Helicopter flies over Utah St. from 16th, rises up before freeway",T5 Productions LLC,Paramount Pictures,Alan Taylor,James Cameron,Arnold Schwarzenegger,Jason Clarke,null
Terminator - Genisys,2015,Van Ness between Fell and Lombard,null,T5 Productions LLC,Paramount Pictures,Alan Taylor,James Cameron,Arnold Schwarzenegger,Jason Clarke,null
Terminator - Genisys,2015,California between Leavenworth and Powell,null,T5 Productions LLC,Paramount Pictures,Alan Taylor,James Cameron,Arnold Schwarzenegger,Jason Clarke,null
Terminator - Genisys,2015,Mission at 1st and 2nd,null,T5 Productions LLC,Paramount Pictures,Alan Taylor,James Cameron,Arnold Schwarzenegger,Jason Clarke,null
Terminator - Genisys,2015,Market at Mason,null,T5 Productions LLC,Paramount Pictures,Alan Taylor,James Cameron,Arnold Schwarzenegger,Jason Clarke,null
Terminator - Genisys,2015,California at Larkin,null,T5 Productions LLC,Paramount Pictures,Alan Taylor,James Cameron,Arnold Schwarzenegger,Jason Clarke,null
Terminator - Genisys,2015,California at Jones,null,T5 Productions LLC,Paramount Pictures,Alan Taylor,James Cameron,Arnold Schwarzenegger,Jason Clarke,null
Terminator - Genisys,2015,Pine and Leavenworth,null,T5 Productions LLC,Paramount Pictures,Alan Taylor,James Cameron,Arnold Schwarzenegger,Jason Clarke,null
Terminator - Genisys,2015,Howard St. from Embarcadero to 11 St.,null,T5 Productions LLC,Paramount Pictures,Alan Taylor,James Cameron,Arnold Schwarzenegger,Jason Clarke,null
Terminator - Genisys,2015,Construction Site in front of 260 Stockton St. at Post St.,null,T5 Productions LLC,Paramount Pictures,Alan Taylor,James Cameron,Arnold Schwarzenegger,Jason Clarke,null
Terminator - Genisys,2015,California St. between Drumm St. and Kearny St.,null,T5 Productions LLC,Paramount Pictures,Alan Taylor,James Cameron,Arnold Schwarzenegger,Jason Clarke,null
Terminator - Genisys,2015,Market St. at Embarcadero area,null,T5 Productions LLC,Paramount Pictures,Alan Taylor,James Cameron,Arnold Schwarzenegger,Jason Clarke,null
Terminator - Genisys,2015,Pine St. between Market and Kearny,null,T5 Productions LLC,Paramount Pictures,Alan Taylor,James Cameron,Arnold Schwarzenegger,Jason Clarke,null
Terminator - Genisys,2015,Front St. between Market and Clay,null,T5 Productions LLC,Paramount Pictures,Alan Taylor,James Cameron,Arnold Schwarzenegger,Jason Clarke,null
Terminator - Genisys,2015,Union Square,null,T5 Productions LLC,Paramount Pictures,Alan Taylor,James Cameron,Arnold Schwarzenegger,Jason Clarke,null
Terminator - Genisys,2015,San Francisco - Oakland Bay Bridge,null,T5 Productions LLC,Paramount Pictures,Alan Taylor,James Cameron,Arnold Schwarzenegger,Jason Clarke,null
Terminator - Genisys,2015,"Mission St., Embarcadero, and Front between Clay and Market",null,T5 Productions LLC,Paramount Pictures,Alan Taylor,James Cameron,Arnold Schwarzenegger,Jason Clarke,null
Terminator - Genisys,2015,Sutter Stockton Garage,null,T5 Productions LLC,Paramount Pictures,Alan Taylor,James Cameron,Arnold Schwarzenegger,Jason Clarke,null
Terminator - Genisys,2015,Bush St. at Stockton St.,null,T5 Productions LLC,Paramount Pictures,Alan Taylor,James Cameron,Arnold Schwarzenegger,Jason Clarke,null
Terminator - Genisys,2015,Powell St at Geary St,null,T5 Productions LLC,Paramount Pictures,Alan Taylor,James Cameron,Arnold Schwarzenegger,Jason Clarke,null
Terminator - Genisys,2015,1 Market St. Landmark Building,null,T5 Productions LLC,Paramount Pictures,Alan Taylor,James Cameron,Arnold Schwarzenegger,Jason Clarke,null
Terminator - Genisys,2015,Embarcadero between Pier 2 and Harrison,null,T5 Productions LLC,Paramount Pictures,Alan Taylor,James Cameron,Arnold Schwarzenegger,Jason Clarke,null
Terminator - Genisys,2015,Pier 14,null,T5 Productions LLC,Paramount Pictures,Alan Taylor,James Cameron,Arnold Schwarzenegger,Jason Clarke,null
Terminator - Genisys,2015,Pine St. between Market and Montgomery,null,T5 Productions LLC,Paramount Pictures,Alan Taylor,James Cameron,Arnold Schwarzenegger,Jason Clarke,null
The Assassination of Richard Nixon,2004,"Tosca Café (242 Columbus Avenue, North Beach)",null,Anhelo Productions,THINKFilm,Niels Mueller,Niels Mueller & Kevin Kennedy,Sean Penn,Naomi Watts,null
The Assassination of Richard Nixon,2004,766 Sutter Street,null,Anhelo Productions,THINKFilm,Niels Mueller,Niels Mueller & Kevin Kennedy,Sean Penn,Naomi Watts,null
The Bachelor,1999,Merchant Exchange (465 California Street at Leidesdorff),null,George Street Pictures,New Line Cinema,Gary Sinyor,Steve Cohen,Chris O'Donnell,Renee Zellweger,null
The Bachelor,1999,Washington Square Park (North Beach),"Washington Square Park is not actually a square, as it has 5 sides. North Beach is not a beach. The statue in the Park is Ben Franklin, not George Washington.",George Street Pictures,New Line Cinema,Gary Sinyor,Steve Cohen,Chris O'Donnell,Renee Zellweger,null
The Bachelor,1999,Sutter-Stockton Garage (330 Sutter Street at Stockton),Garage roof serves as a heliport in the movie,George Street Pictures,New Line Cinema,Gary Sinyor,Steve Cohen,Chris O'Donnell,Renee Zellweger,null
The Bachelor,1999,Stockton Tunnel (Stockton Street at Sutter Street),"Opened in 1914, the Stockton Tunnel was built to provide North Beach residents access to the thriving downtown area.",George Street Pictures,New Line Cinema,Gary Sinyor,Steve Cohen,Chris O'Donnell,Renee Zellweger,null
The Bachelor,1999,"Steinhart Aquarium (California Academy of Sciences, Golden Gate Park)","The Steinhart Aquarium is home to over 38,000 animals, which represent more than 900 species. ",George Street Pictures,New Line Cinema,Gary Sinyor,Steve Cohen,Chris O'Donnell,Renee Zellweger,null
The Bachelor,1999,"St. Peter & Paul's Church (666 Filbert Street, Washington Square)","Though Marilyn Monroe and Joe DiMaggio were not allowed to be married at the Church (DiMaggio had married his first wife at the Church but was divorced), the couple returned to the steps of the Church for photos, following their City Hall nuptials.",George Street Pictures,New Line Cinema,Gary Sinyor,Steve Cohen,Chris O'Donnell,Renee Zellweger,null
The Bachelor,1999,Roof of Cable Car (California at Front Street),SF Cable Cars are the only moving National Historical Landmark.,George Street Pictures,New Line Cinema,Gary Sinyor,Steve Cohen,Chris O'Donnell,Renee Zellweger,null
The Bachelor,1999,Pacific Stock Exchange (301 Pine Street at Sansome),null,George Street Pictures,New Line Cinema,Gary Sinyor,Steve Cohen,Chris O'Donnell,Renee Zellweger,null
The Bachelor,1999,Nina M. Designs (52 2nd Street at Jessie),null,George Street Pictures,New Line Cinema,Gary Sinyor,Steve Cohen,Chris O'Donnell,Renee Zellweger,null
The Bachelor,1999,Moose's Restaurant (1652 Stockton),null,George Street Pictures,New Line Cinema,Gary Sinyor,Steve Cohen,Chris O'Donnell,Renee Zellweger,null
The Bachelor,1999,Mama's Restaurant (1701 Stockton),null,George Street Pictures,New Line Cinema,Gary Sinyor,Steve Cohen,Chris O'Donnell,Renee Zellweger,null
The Bachelor,1999,Danilo's Bakery (Green Street & Bannam Place),null,George Street Pictures,New Line Cinema,Gary Sinyor,Steve Cohen,Chris O'Donnell,Renee Zellweger,null
The Bachelor,1999,Columbus Avenue at Green & Stockton,null,George Street Pictures,New Line Cinema,Gary Sinyor,Steve Cohen,Chris O'Donnell,Renee Zellweger,null
Sense8,2015,"""Metzger's Apt"" 151 Alice B. Toklas Pl.","Overnight scene involving aggressive arguments between actors, spfx shoot out involved","Unpronounceable Productions, LLC",Netflix,The Wachowskis,The Wachowskis,Jamie Clayton,null,null
The Bridge,2006,Golden Gate Bridge,"With 23 miles of ladders and 300,000 rivets in each tower, the Golden Gate Bridge was the world's longest span when it opened in 1937.",Easy There Tiger Productions,IFC Films,Eric Steel,null,John Snowden,null,null
Live Nude Girls Unite,2000,Lusty Lady Bar (North Beach),null,Constant Communication,First Run Features,Vicky Funari,Vicky Funari,null,null,null
Chance - Season 1ep105,2016,Private alley along 20th St. between Tennessee and Minnesota,null,TVM Productions,HULU,Victoria Morrow,Roxann Dawson,Hugh Laurie,Gretchen Mol,Ethan Suplee
The Californians,2005,null,null,Parker Film Company,Fabrication Films,Jonathan Parker,Jonathan Parker & Catherine DiNapoli,Noah Wyle,null,null
The Candidate,1972,"Westin St. Francis Hotel (335 Powell Street, Union Square)","The hotel was originally supposed to be named the Crocker Hotel, after Charles Founder the railroad magnate who founded it. However, the hotel took the name the St. Francis after one of the earliest Gold Rush hotels. ",Redford-Ritchie Productions,Warner Bros. Pictures,Michael Ritchie,Jeremy Larner,Robert Redford,Peter Boyle,null
"Play it Again, Sam",1972,Balboa at 22nd Avenue,null,Paramount Pictures,Paramount Pictures,Herbert Ross,Woody Allen,Woody Allen,Diane Keaton,Tony Roberts
Time After Time,1979,100 Block of Union Street (Cow Hollow),null,Orion Pictures Corp.,Columbia Broadcasting System (CBS),Nicholas Meyer,Karl Alexander,Malcolm McDowell,Mary Steenburgen,David Warner
Looking,2014,"Tiburon Hiking Trail, Tiburon, CA",null,"Mission Street Productions, LLC",Home Box Office (HBO),Andrew Haigh,Michael Lannan,Jonathan Groff,Frankie J. Alvarez,Murray Bartlett
The Last Black Man in San Francisco,2019,"Sunset Super, 2425 Irving St",null,"LBMISF, LLC",A54,Joe Talbot,"Joe Talbot, Jimmie Fails, Rob Richert",Jimmie Fails,Jonathan Majors,Danny Glover
San Andreas,2015,Bay St. at Polk,null,"Upside Down Productions, Inc.",Warner Bros.,Brad Peyton,Allan Loeb,Dwayne Johnson,null,null
"Budding Prospects, Pilot",2017,40 Prentiss Street,null,Picrow Streaming Inc.,Amazon,Terry Zwigoff,"Melissa Axelrod, T. C. Boyle (based on the book by)",Adam Rose,Will Sasso,Joel David Moore
Copycat,1995,82 & 67 Rico Way (Marina District),null,Regency Enterprises,Warner Bros. Pictures,Jon Amiel,Ann Biderman,Sigourney Weaver,Holly Hunter,null
So I Married an Axe Murderer,1993,Fog City Diner (1300 Battery Street),null,TriStar Pictures,TriStar Pictures,Thomas Schlamme,Robbie Fox,Mike Myers,Nancy Travis,null
The Game,1997,Ritz-Carlton Hotel (600 Stockton Street),null,Polygram Filmed Entertainment,Polygram Filmed Entertainment,David Fincher,John Brancato,Michael Douglas,Sean Penn,Deborah Kara Unger
Jagged Edge,1985,City Hall,"The dome of SF's City Hall is almost a foot taller than that of the US Capitol Building. In 1954, Joe DiMaggio and Marilyn Monroe married at the Beaux Arts-style building.",Columbia Pictures Corp.,Columbia Pictures,Richard Marquand,Joe Eszterhas,Glenn Close,Jeff Bridges,Peter Coyote
True Believer,1989,null,null,Columbia Pictures Corporation,Columbia Pictures,Joseph Ruben,Wesley Strick,James Woods,"Robert Downey, Jr.",null
The Last Black Man in San Francisco,2019,"Portola Rose Garden, 598 Hamilton St at Woolsey St",null,"LBMISF, LLC",A46,Joe Talbot,"Joe Talbot, Jimmie Fails, Rob Richert",Jimmie Fails,Jonathan Majors,Danny Glover
"Murder in the First, Season 3",2016,Harriet Alley,null,Turner North Center Productions,Turner Network Television (TNT),Steven Bochcho,Eric Lodal,Taye Diggs,Kathleen Robertson,Ian Anthony Dale
Sense8 - Season 2,2016,Washington between Stockton and Kearny,null,"Unpronounceable Productions, LLC",Netflix,Wachowski Siblings,"J. Michael Straczynski, Wachowiski Siblings",Jamie Clayton,Daryl Hannah,Naveen Andrews
High Crimes,2002,Chase H & Q  (1 Bush Street at Sansome),null,Twentieth Century Fox Film Corporation,Twentieth Century Fox Film Corporation,Mel Brooks,Mel Brooks,Mel Brooks,Madeline Kahn,null
Sense8,2015,16th St.,Driving shots,"Unpronounceable Productions, LLC",Netflix,The Wachowskis,The Wachowskis,Jamie Clayton,null,null
Tales of the City,2019,"City Lights Books, 261 Columbus Ave",null,Universal Television LLC,Netflix,"Alan Poul, Silas Howard, Stacie Passon","Armistead Maupin, Lauren Morelli, Hansol Jung, Marcus Gardley",Laura Linney,Ellen Page,Murray Bartlett
The Core,2003,Golden Gate Bridge,"With 23 miles of ladders and 300,000 rivets in each tower, the Golden Gate Bridge was the world's longest span when it opened in 1937.",David Foster Productions,Paramount Pictures,John Amiel,Cooper Lane,Aaron Eckhart,Hilary Swank,null
Nine Months,1995,60 Spear Street,null,1492 Pictures,Twentieth Century Fox Film Corp.,Chris Columbus,Chris Columbus,Hugh Grant,Julianne Moore,Robin Williams
Etruscan Smile,2017,California Street between Sansome & Davis,null,"Po Valley Productions, LLC",TBD,Oded Binnun/ Michel Brezis,"Sarah Bellwood, Michal Lali Kagan, Michael McGowan Amital Stern, Jose Luis Sampedro",Brian Cox,Roseanne Arquette,Thora Birch
A Taiwanese Tale of Two Cities,2018,2751 Mission St,null,Envision Productions Inc.,Netflix,Tien-Lun Yeh,"Ling-Hui Chen, Nancy Chen, Chih-Chi Fan, Chia-Hui Lin",Tammy Cheng,Peggy Tseng,Shen-Hao Wen
Summertime,2015,Montgomery between California and Pine,null,"Creative Monster Productions, Inc.",11 Distribution,Gabriele Muccino,Gabriele Muccino,Jessica Rothe,Scott Bakula,Matilda Anna Ingrid Lutz
Freebie and the Bean,1974,Candlestick Park (602 Jamestown Ave.),"Then Vice President Richard Nixon threw out the first pitch when Candlestick opened in 1960. On August 29, 1966, The Beatles played their last concert for paying fans at Candlestick Park.",Warner Bros. Pictures,American Broadcasting Company (ABC),Richard Rush,Robert Kaufman,Alan Arkin,James Caan,Loretta Swit
Sense8 - Season 2,2016,"The Women's Building, 3543 18th St.","The mural painted outside the building was painted by 7 women artists including Juana Alicia, Miranda Bergman and Meera Desai. The computer lab scene was filmed inside the building.","Unpronounceable Productions, LLC",Netflix,Wachowski Siblings,"J. Michael Straczynski, Wachowiski Siblings",Jamie Clayton,Daryl Hannah,Naveen Andrews
The OA Part II,2019,Duncan St at Diamond Heights,null,Lunar Mining LLC,Netflix,Zal Batmanglij,"Zal Batmanglij, Brit Marling",Brit Marling,Emory Cohen,Patrick Gibson
The OA Part II,2019,Washington at Taylor St - Jackson St,null,Lunar Mining LLC,Netflix,Zal Batmanglij,"Zal Batmanglij, Brit Marling",Brit Marling,Emory Cohen,Patrick Gibson
Godzilla,2014,Pine St. & Davis St,null,"Nautilus Productions, LLC",Warner Bros. Pictures,Gareth Edwards,Max Borenstein,Aaron Taylor-Johnson,Elizabeth Olsen,Bryan Cranston
Americana,2015,Coi Restaurant (373 Broadway),null,Sutro Films LLC,null,Zachary Shedd,Zachary Shedd,Kelli Garner,Jack Davenport,Peter Coyote
The OA Part II,2019,Ada Court at O'Farrell St,null,Lunar Mining LLC,Netflix,Zal Batmanglij,"Zal Batmanglij, Brit Marling",Brit Marling,Emory Cohen,Patrick Gibson
Star Trek IV: The Voyage Home,1986,Kearny & Pacific Streets,null,Paramount Pictures,Paramount Pictures,Leonard Nimoy,Steve Meerson,William Shatner,Leonard Nimoy,George Takei
Chance Season 2,2017,Presidio Heights Neighborhood,null,TVM Productions Inc.,Hulu,Rozann Dawson,Alexandra Cunningham,Hugh Laurie,Greta Lee,Ethan Suplee
Sudden Impact,1983,"Near Point Lobos, El Camino Del Mar",null,Warner Bros. Pictures,Warner Bros. Pictures,Clint Eastwood,Harry Julian Fink,Clint Eastwood,Sondra Locke,null
The Presidio,1988,"Fort Point (Presidio, Golden Gate National Recreation Area)","Built in 1853, Fort Point is the only West Coast fort built by the Union Army. Though the Confederate army planned to attack San Francisco, the commanding Confederate general learned that the war had ended while end route to SF.",Paramount Pictures,Paramount Pictures,Peter Hyams,Larry Ferguson,Sean Connery,Mark Harmon,Meg Ryan
Basic Instinct,1992,Hall of Justice (850 Bryant Street),null,Carolco Pictures,TriStar Pictures,Paul Verhoeven,Joe Eszterhas,Michael Douglas,Sharon Stone,George Dzundza
The Game,1997,Merchant Exchange Building (465 California Street),null,Polygram Filmed Entertainment,Polygram Filmed Entertainment,David Fincher,John Brancato,Michael Douglas,Sean Penn,Deborah Kara Unger
Foul Play,1978,Fort Mason (Golden Gate National Recreation Area),"Constructed in 1864 as a coastal defense site, Fort Mason went on to serve as an army post for more than 100 years.",Paramount Pictures,Paramount Pictures,Colin Higgins,Colin Higgins,Goldie Hawn,Chevy Chase,Burgess Meredith
Basic Instinct,1992,Pier 7 (The Embarcadero),null,Carolco Pictures,TriStar Pictures,Paul Verhoeven,Joe Eszterhas,Michael Douglas,Sharon Stone,George Dzundza
Sense8 - Season 2,2016,Green between Kearny and Montgomery,null,"Unpronounceable Productions, LLC",Netflix,Wachowski Siblings,"J. Michael Straczynski, Wachowiski Siblings",Jamie Clayton,Daryl Hannah,Naveen Andrews
Looking Season 2 ep 205,2015,"Always Open Car Wash, 2560 Marin Street",null,"Mission Street Productions, LLC",HBO,Andrew Haigh,Michael Lannan,Jonathan Groff,Frankie Alvarez,Murray Bartlett
Pleasure of His Company,1961,Grace Cathedral Episcopal Church (1100 California Street),Grace Cathedral Episcopal Church is the West Coast's largest Episcopalian cathedral.,Perlsea Company,Paramount Pictures,George Seaton,Samuel A. Taylor,Fred Astaire,Debbie Reynolds,Lilli Palmer
Sense8,2015,Laguna Honda Hospital; 375 Laguna Honda Blvd.,dialogue scene,"Unpronounceable Productions, LLC",Netflix,The Wachowskis,The Wachowskis,Jamie Clayton,null,null
"Murder in the First, Season 2",2015,Pennsylvania Avenue at 19th Street,null,Turner North Center Productions,Turner Network Television (TNT),Steven Bochcho,Eric Lodal,Taye Diggs,Kathleen Robertson,Ian Anthony Dale
Americana,2015,Foreign Cinema (2534 Mission),null,Sutro Films LLC,null,Zachary Shedd,Zachary Shedd,Kelli Garner,Jack Davenport,Peter Coyote
Invasion of the Body Snatchers,1978,1227 Montgomery Street (Telegraph Hill),null,Solofilm,United Artists,Philip Kaufman,Jack Finney,Donald Sutherland,Jeff Goldblum,Brooke Adams
The Diary of a Teenage Girl,2015,Victoria Theatre,null,"Diary the Movie, LLC",Sony Pictures Classics,Marielle Heller,Marielle Heller,Alexander Skarsgard,Kristen Wiig,Christopher Meloni
The Diary of a Teenage Girl,2015,SPECS' Twelve Adler Museum Café,null,"Diary the Movie, LLC",Sony Pictures Classics,Marielle Heller,Marielle Heller,Alexander Skarsgard,Kristen Wiig,Christopher Meloni
The Diary of a Teenage Girl,2015,Ocean Beach at Point Lobos,null,"Diary the Movie, LLC",Sony Pictures Classics,Marielle Heller,Marielle Heller,Alexander Skarsgard,Kristen Wiig,Christopher Meloni
The Diary of a Teenage Girl,2015,700 Kansas St.,null,"Diary the Movie, LLC",Sony Pictures Classics,Marielle Heller,Marielle Heller,Alexander Skarsgard,Kristen Wiig,Christopher Meloni
The Diary of a Teenage Girl,2015,Presidio Branch Library,null,"Diary the Movie, LLC",Sony Pictures Classics,Marielle Heller,Marielle Heller,Alexander Skarsgard,Kristen Wiig,Christopher Meloni
The Diary of a Teenage Girl,2015,The Royal Oak,null,"Diary the Movie, LLC",Sony Pictures Classics,Marielle Heller,Marielle Heller,Alexander Skarsgard,Kristen Wiig,Christopher Meloni
The Diary of a Teenage Girl,2015,Tonic,null,"Diary the Movie, LLC",Sony Pictures Classics,Marielle Heller,Marielle Heller,Alexander Skarsgard,Kristen Wiig,Christopher Meloni
The Diary of a Teenage Girl,2015,Polk and Northpoint St.,null,"Diary the Movie, LLC",Sony Pictures Classics,Marielle Heller,Marielle Heller,Alexander Skarsgard,Kristen Wiig,Christopher Meloni
The Diary of a Teenage Girl,2015,770 Haight St.,null,"Diary the Movie, LLC",Sony Pictures Classics,Marielle Heller,Marielle Heller,Alexander Skarsgard,Kristen Wiig,Christopher Meloni
The Diary of a Teenage Girl,2015,Tank Hill Park,null,"Diary the Movie, LLC",Sony Pictures Classics,Marielle Heller,Marielle Heller,Alexander Skarsgard,Kristen Wiig,Christopher Meloni
The Diary of a Teenage Girl,2015,Hamburger Haven,null,"Diary the Movie, LLC",Sony Pictures Classics,Marielle Heller,Marielle Heller,Alexander Skarsgard,Kristen Wiig,Christopher Meloni
The Diary of a Teenage Girl,2015,Higher Grounds Coffee House,null,"Diary the Movie, LLC",Sony Pictures Classics,Marielle Heller,Marielle Heller,Alexander Skarsgard,Kristen Wiig,Christopher Meloni
The Diary of a Teenage Girl,2015,304 Lily St.,null,"Diary the Movie, LLC",Sony Pictures Classics,Marielle Heller,Marielle Heller,Alexander Skarsgard,Kristen Wiig,Christopher Meloni
The Diary of a Teenage Girl,2015,The Magazine at 920 Larkin,null,"Diary the Movie, LLC",Sony Pictures Classics,Marielle Heller,Marielle Heller,Alexander Skarsgard,Kristen Wiig,Christopher Meloni
The Diary of a Teenage Girl,2015,Geary St. from Polk to Larkin,null,"Diary the Movie, LLC",Sony Pictures Classics,Marielle Heller,Marielle Heller,Alexander Skarsgard,Kristen Wiig,Christopher Meloni
The Diary of a Teenage Girl,2015,Yerba Buena Island,null,"Diary the Movie, LLC",Sony Pictures Classics,Marielle Heller,Marielle Heller,Alexander Skarsgard,Kristen Wiig,Christopher Meloni
The Doctor,1991,null,null,Silver Screen Partners IV,Buena Vista Pictures,Randa Haines,Robert Caswell,William Hurt,Christine Lahti,null
The Doors,1991,null,null,Bill Graham Films,TriStar Pictures,Oliver Stone,J. Randal Johnson,Val Kilmer,Meg Ryan,null
The OA Part II,2019,Mission Rock at 3rd St,null,Lunar Mining LLC,Netflix,Zal Batmanglij,"Zal Batmanglij, Brit Marling",Brit Marling,Emory Cohen,Patrick Gibson
