Title,ReleaseYear,Locations,FunFacts,ProductionCompany,Distributor,Director,Writer,Actor1,Actor2,Actor3
180,2011,Epic Roasthouse (399 Embarcadero),null,SPI Cinemas,null,Jayendra,"Umarji Anuradha, Jayendra, Aarthi Sriram, & Suba ",Siddarth,Nithya Menon,Priya Anand
180,2011,Mason & California Streets (Nob Hill),null,SPI Cinemas,null,Jayendra,"Umarji Anuradha, Jayendra, Aarthi Sriram, & Suba ",Siddarth,Nithya Menon,Priya Anand
180,2011,Justin Herman Plaza,null,SPI Cinemas,null,Jayendra,"Umarji Anuradha, Jayendra, Aarthi Sriram, & Suba ",Siddarth,Nithya Menon,Priya Anand
180,2011,200 block Market Street,null,SPI Cinemas,null,Jayendra,"Umarji Anuradha, Jayendra, Aarthi Sriram, & Suba ",Siddarth,Nithya Menon,Priya Anand
180,2011,City Hall,null,SPI Cinemas,null,Jayendra,"Umarji Anuradha, Jayendra, Aarthi Sriram, & Suba ",Siddarth,Nithya Menon,Priya Anand
180,2011,Polk & Larkin Streets,null,SPI Cinemas,null,Jayendra,"Umarji Anuradha, Jayendra, Aarthi Sriram, & Suba ",Siddarth,Nithya Menon,Priya Anand
180,2011,Randall Museum,null,SPI Cinemas,null,Jayendra,"Umarji Anuradha, Jayendra, Aarthi Sriram, & Suba ",Siddarth,Nithya Menon,Priya Anand
180,2011,555 Market St.,null,SPI Cinemas,null,Jayendra,"Umarji Anuradha, Jayendra, Aarthi Sriram, & Suba ",Siddarth,Nithya Menon,Priya Anand
24 Hours on Craigslist,2005,null,null,Yerba Buena Productions,Zealot Pictures,Michael Ferris Gibson,null,Craig Newmark,null,null
Summertime,2015,Alamo Square ,null,"Creative Monster Productions, Inc.",7 Distribution,Gabriele Muccino,Gabriele Muccino,Jessica Rothe,Scott Bakula,Matilda Anna Ingrid Lutz
Ballers Season 3,2017,San Remo Hotel (2237 Mason),null,"Chori Perros Productions, LLC",HBO,Julian Farino,Stephen Levinson,Dwayne Johnson,John David Washington,Omar Benson Miller
Chance Season 2,2017,Waller St between Masonic and Del Mar St,null,TVM Productions Inc.,Hulu,Rozann Dawson,Alexandra Cunningham,Hugh Laurie,Greta Lee,Ethan Suplee
Chance Season 2,2017,Palace of Fine Arts (3301 Lyon Street),null,TVM Productions Inc.,Hulu,Rozann Dawson,Alexandra Cunningham,Hugh Laurie,Greta Lee,Ethan Suplee
A Night Full of Rain,1978,Embarcadero Freeway,"Embarcadero Freeway, which was featured in the film was demolished in 1989 because of structural damage from the 1989 Loma Prieta Earthquake)",Liberty Film,Warner Bros. Pictures,Lina Wertmuller,Lina Wertmuller,Candice Bergen,Giancarlo Gianni,null
A Night Full of Rain,1978,"Fairmont Hotel (950 Mason Street, Nob Hill)","In 1945 the Fairmont hosted the United Nations Conference on International Organization as delegates arrived to draft a charter for the organization. The U.S. Secretary of State, Edward Stettinius drafted the charter in the hotel's Garden Room.",Liberty Film,Warner Bros. Pictures,Lina Wertmuller,Lina Wertmuller,Candice Bergen,Giancarlo Gianni,null
A Night Full of Rain,1978,San Francisco Chronicle (901 Mission Street at 15th Street),The San Francisco Zodiac Killer of the late 1960s sent his notes and letters to the Chronicle's offices.,Liberty Film,Warner Bros. Pictures,Lina Wertmuller,Lina Wertmuller,Candice Bergen,Giancarlo Gianni,null
A Night Full of Rain,1978,Broadway (North Beach),null,Liberty Film,Warner Bros. Pictures,Lina Wertmuller,Lina Wertmuller,Candice Bergen,Giancarlo Gianni,null
Chance Season 2,2017,20th St between Church and Dolores St,null,TVM Productions Inc.,Hulu,Rozann Dawson,Alexandra Cunningham,Hugh Laurie,Greta Lee,Ethan Suplee
Vegas in Space,1992,Under Highway 101 (near Potrero and Cesar Chavez Streets),null,Troma Entertainment,MCA/Universal Home Video,Phillip R. Ford,Doris Fish,Doris Fish,Miss X,Ginger Quest
Vegas in Space,1992,544 Natoma (SOMA),null,Troma Entertainment,MCA/Universal Home Video,Phillip R. Ford,Doris Fish,Doris Fish,Miss X,Ginger Quest
Chance Season 2,2017,Haight between Central and Ashbury St,null,TVM Productions Inc.,Hulu,Rozann Dawson,Alexandra Cunningham,Hugh Laurie,Greta Lee,Ethan Suplee
Summertime,2015,Chinatown (Stockton @ Jackson & Jackson toward Grant,null,"Creative Monster Productions, Inc.",10 Distribution,Gabriele Muccino,Gabriele Muccino,Jessica Rothe,Scott Bakula,Matilda Anna Ingrid Lutz
Summertime,2015,Broadway and Taylor St Intersection,null,"Creative Monster Productions, Inc.",3 Distribution,Gabriele Muccino,Gabriele Muccino,Jessica Rothe,Scott Bakula,Matilda Anna Ingrid Lutz
Chance Season 2,2017,Union St at Leavenworth St,null,TVM Productions Inc.,Hulu,Rozann Dawson,Alexandra Cunningham,Hugh Laurie,Greta Lee,Ethan Suplee
Summertime,2015,Buena Vista East & Duboce; Buena Vista East & Haight,null,"Creative Monster Productions, Inc.",5 Distribution,Gabriele Muccino,Gabriele Muccino,Jessica Rothe,Scott Bakula,Matilda Anna Ingrid Lutz
Nine Months,1995,Star's Café (55 Golden Gate Avenue at Van Ness),null,1492 Pictures,Twentieth Century Fox Film Corp.,Chris Columbus,Chris Columbus,Hugh Grant,Julianne Moore,Robin Williams
Summertime,2015,Love Street Vintage (1506 Haight & adjacent Haight sidewalk_,null,"Creative Monster Productions, Inc.",6 Distribution,Gabriele Muccino,Gabriele Muccino,Jessica Rothe,Scott Bakula,Matilda Anna Ingrid Lutz
Summertime,2015,Montgomery between California and Pine,null,"Creative Monster Productions, Inc.",11 Distribution,Gabriele Muccino,Gabriele Muccino,Jessica Rothe,Scott Bakula,Matilda Anna Ingrid Lutz
Vegas in Space,1992,3567 18th Street,null,Troma Entertainment,MCA/Universal Home Video,Phillip R. Ford,Doris Fish,Doris Fish,Miss X,Ginger Quest
Chance Season 2,2017,Embarcadero between Bay and Chestnut St,null,TVM Productions Inc.,Hulu,Rozann Dawson,Alexandra Cunningham,Hugh Laurie,Greta Lee,Ethan Suplee
Vegas in Space,1992,Corona Heights Park,null,Troma Entertainment,MCA/Universal Home Video,Phillip R. Ford,Doris Fish,Doris Fish,Miss X,Ginger Quest
Beautiful Boy,2018,Tenderloin Neighborhood,null,Big Indie Pictures,Amazon Studios,Felix van Groeningen,Luke Davies,Steve Carell,Timothee Chalamet,Maura Tierney
Chance Season 2,2017,Haight St at Ashbury St,null,TVM Productions Inc.,Hulu,Rozann Dawson,Alexandra Cunningham,Hugh Laurie,Greta Lee,Ethan Suplee
Chance Season 2,2017,Filbert St at Stockton St,null,TVM Productions Inc.,Hulu,Rozann Dawson,Alexandra Cunningham,Hugh Laurie,Greta Lee,Ethan Suplee
Chance Season 2,2017,Heron @ Berwick (off 8th and Harrison St),null,TVM Productions Inc.,Hulu,Rozann Dawson,Alexandra Cunningham,Hugh Laurie,Greta Lee,Ethan Suplee
Ballers Season 3,2017,Driving around Taylor/Pacific/Leavenworth,null,"Chori Perros Productions, LLC",HBO,Julian Farino,Stephen Levinson,Dwayne Johnson,John David Washington,Omar Benson Miller
Chance Season 2,2017,Leavenworth at McAllister St,null,TVM Productions Inc.,Hulu,Rozann Dawson,Alexandra Cunningham,Hugh Laurie,Greta Lee,Ethan Suplee
About a Boy,2014,Broderick from Fulton to McAlister,null,NBC Studios,National Broadcasting Company,Mark J. Kunerth,Jason Katims,David Walton,Minnie Driver,null
About a Boy,2014,Crissy Field,null,NBC Studios,National Broadcasting Company,Mark J. Kunerth,Jason Katims,David Walton,Minnie Driver,null
About a Boy,2014,Powell from Bush and Sutter,null,NBC Studios,National Broadcasting Company,Mark J. Kunerth,Jason Katims,David Walton,Minnie Driver,null
Age of Adaline,2015,Pier 50- end of the pier,null,Lionsgate / Sidney Kimmel Entertainment / Lakeshore Entertainment,null,Lee Toland Krieger,J. Mills Goodloe,Blake Lively,Harrison Ford,Ellen Burstyn
Age of Adaline,2015,California @ Montgomery,null,Lionsgate / Sidney Kimmel Entertainment / Lakeshore Entertainment,null,Lee Toland Krieger,J. Mills Goodloe,Blake Lively,Harrison Ford,Ellen Burstyn
Age of Adaline,2015,Montgomery/Green,null,Lionsgate / Sidney Kimmel Entertainment / Lakeshore Entertainment,null,Lee Toland Krieger,J. Mills Goodloe,Blake Lively,Harrison Ford,Ellen Burstyn
Age of Adaline,2015,Driving various SF Streets,null,Lionsgate / Sidney Kimmel Entertainment / Lakeshore Entertainment,null,Lee Toland Krieger,J. Mills Goodloe,Blake Lively,Harrison Ford,Ellen Burstyn
Age of Adaline,2015,Plate Shots SF streets various,null,Lionsgate / Sidney Kimmel Entertainment / Lakeshore Entertainment,null,Lee Toland Krieger,J. Mills Goodloe,Blake Lively,Harrison Ford,Ellen Burstyn
After the Thin Man,1936,Coit Tower,"The Tower was funded by a gift bequeathed by Lillie Hitchcock Coit, a socialite who reportedly liked to chase fires. Though the tower resembles a firehose nozzle, it was not designed this way.",Metro-Goldwyn Mayer,Metro-Goldwyn Mayer,W.S. Van Dyke,Frances Goodrich,William Powell,Myrna Loy,James Stewart
Chance Season 2,2017,Presidio Heights Neighborhood ,null,TVM Productions Inc.,Hulu,Rozann Dawson,Alexandra Cunningham,Hugh Laurie,Greta Lee,Ethan Suplee
Ballers Season 3,2017,"Huntington Park (California & Taylor Streets, Nob Hill)",null,"Chori Perros Productions, LLC",HBO,Julian Farino,Stephen Levinson,Dwayne Johnson,John David Washington,Omar Benson Miller
Chance Season 2,2017,Duboce between Buena Vista East and Alpine St,null,TVM Productions Inc.,Hulu,Rozann Dawson,Alexandra Cunningham,Hugh Laurie,Greta Lee,Ethan Suplee
Vegas in Space,1992,422 Oak Street at Laguna,null,Troma Entertainment,MCA/Universal Home Video,Phillip R. Ford,Doris Fish,Doris Fish,Miss X,Ginger Quest
Chance Season 2,2017,Mason between Sacramento and California St,null,TVM Productions Inc.,Hulu,Rozann Dawson,Alexandra Cunningham,Hugh Laurie,Greta Lee,Ethan Suplee
Summertime,2015,Sansome (Washington to Bush) Pine (Davis to Kearny) Bush: Kearny to Battery,null,"Creative Monster Productions, Inc.",9 Distribution,Gabriele Muccino,Gabriele Muccino,Jessica Rothe,Scott Bakula,Matilda Anna Ingrid Lutz
Summertime,2015,Stanyan & Belgrave,null,"Creative Monster Productions, Inc.",8 Distribution,Gabriele Muccino,Gabriele Muccino,Jessica Rothe,Scott Bakula,Matilda Anna Ingrid Lutz
Chance Season 2,2017,Central St between Haight and Page St,null,TVM Productions Inc.,Hulu,Rozann Dawson,Alexandra Cunningham,Hugh Laurie,Greta Lee,Ethan Suplee
Ant-Man,2015,California between Kearney and Davis,Driving shots,"PYM Particles Productions, LLC",Walt Disney Studios Motion Pictures,Peyton Reed,Gabriel Ferrari ,Michael Douglas,Paul Rudd,null
Ballers Season 3,2017,Embarcadero around Rincon Park,null,"Chori Perros Productions, LLC",HBO,Julian Farino,Stephen Levinson,Dwayne Johnson,John David Washington,Omar Benson Miller
Beautiful Boy,2018,Haight at Masonic,null,Big Indie Pictures,Amazon Studios,Felix van Groeningen,Luke Davies,Steve Carell,Timothee Chalamet,Maura Tierney
Americana,2015,St. Francis Episcopal Church (399 San Fernando Way),null,Sutro Films LLC,null,Zachary Shedd,Zachary Shedd,Kelli Garner,Jack Davenport,Peter Coyote
Americana,2015,Romolo Place @ Fresno St.,null,Sutro Films LLC,null,Zachary Shedd,Zachary Shedd,Kelli Garner,Jack Davenport,Peter Coyote
Americana,2015,Palace of Fine Arts,null,Sutro Films LLC,null,Zachary Shedd,Zachary Shedd,Kelli Garner,Jack Davenport,Peter Coyote
Americana,2015,John Shelley Drive John McLaren Park,null,Sutro Films LLC,null,Zachary Shedd,Zachary Shedd,Kelli Garner,Jack Davenport,Peter Coyote
Americana,2015,Treasure Island,null,Sutro Films LLC,null,Zachary Shedd,Zachary Shedd,Kelli Garner,Jack Davenport,Peter Coyote
Americana,2015,The San Francisco School (300 Gavin St.),null,Sutro Films LLC,null,Zachary Shedd,Zachary Shedd,Kelli Garner,Jack Davenport,Peter Coyote
Americana,2015,33 Spruce St,null,Sutro Films LLC,null,Zachary Shedd,Zachary Shedd,Kelli Garner,Jack Davenport,Peter Coyote
Americana,2015,Coi Restaurant (373 Broadway),null,Sutro Films LLC,null,Zachary Shedd,Zachary Shedd,Kelli Garner,Jack Davenport,Peter Coyote
Summertime,2015,Duboce Park,null,"Creative Monster Productions, Inc.",13 Distribution,Gabriele Muccino,Gabriele Muccino,Jessica Rothe,Scott Bakula,Matilda Anna Ingrid Lutz
Chance Season 2,2017,Market St at Embarcadero,null,TVM Productions Inc.,Hulu,Rozann Dawson,Alexandra Cunningham,Hugh Laurie,Greta Lee,Ethan Suplee
Americana,2015,Foreign Cinema (2534 Mission),null,Sutro Films LLC,null,Zachary Shedd,Zachary Shedd,Kelli Garner,Jack Davenport,Peter Coyote
Americana,2015,Bernal Heights Park,null,Sutro Films LLC,null,Zachary Shedd,Zachary Shedd,Kelli Garner,Jack Davenport,Peter Coyote
Americana,2015,Jackson St. at Spruce,null,Sutro Films LLC,null,Zachary Shedd,Zachary Shedd,Kelli Garner,Jack Davenport,Peter Coyote
Americana,2015,679 Madrid St,null,Sutro Films LLC,null,Zachary Shedd,Zachary Shedd,Kelli Garner,Jack Davenport,Peter Coyote
Americana,2015,Roxie Theater (3117 16th St.),null,Sutro Films LLC,null,Zachary Shedd,Zachary Shedd,Kelli Garner,Jack Davenport,Peter Coyote
Americana,2015,Variety Preview Room (582 Market St.),null,Sutro Films LLC,null,Zachary Shedd,Zachary Shedd,Kelli Garner,Jack Davenport,Peter Coyote
Americana,2015,Laguna Honda Hospital; 375 Laguna Honda Blvd.,null,Sutro Films LLC,null,Zachary Shedd,Zachary Shedd,Kelli Garner,Jack Davenport,Peter Coyote
Americana,2015,3232 Jackson Ave.,null,Sutro Films LLC,null,Zachary Shedd,Zachary Shedd,Kelli Garner,Jack Davenport,Peter Coyote
Americana,2015,20th St and Illinois/Faxon St. and Kenwood/Glenbrook at Mt. Springs,null,Sutro Films LLC,null,Zachary Shedd,Zachary Shedd,Kelli Garner,Jack Davenport,Peter Coyote
Chance Season 2,2017,Lombard St between Leavenworth and Hyde St,null,TVM Productions Inc.,Hulu,Rozann Dawson,Alexandra Cunningham,Hugh Laurie,Greta Lee,Ethan Suplee
Beautiful Boy,2018,Wisconsin between 19th and 20th St,null,Big Indie Pictures,Amazon Studios,Felix van Groeningen,Luke Davies,Steve Carell,Timothee Chalamet,Maura Tierney
Ballers Season 3,2017,"Fairmont Hotel (950 Mason Street, Nob Hill)",null,"Chori Perros Productions, LLC",HBO,Julian Farino,Stephen Levinson,Dwayne Johnson,John David Washington,Omar Benson Miller
Another 48 Hours,1990,null,null,Eddie Murphy Productions,Paramount Pictures,Walter Hill,Walter Hill,Eddie Murphy,Nick Nolte,null
Ant-Man,2015,Conzelman Rd at McCollough Rd and down Conzelman Rd.,Aerial shots,"PYM Particles Productions, LLC",Walt Disney Studios Motion Pictures,Peyton Reed,Gabriel Ferrari ,Michael Douglas,Paul Rudd,null
Ant-Man,2015,Lombard at Hyde,null,"PYM Particles Productions, LLC",Walt Disney Studios Motion Pictures,Peyton Reed,Gabriel Ferrari ,Michael Douglas,Paul Rudd,null
Ant-Man,2015,601 Buena Vista Ave West at Java St.,null,"PYM Particles Productions, LLC",Walt Disney Studios Motion Pictures,Peyton Reed,Gabriel Ferrari ,Michael Douglas,Paul Rudd,null
Ant-Man,2015,420 Jones St. at Ellis St.,null,"PYM Particles Productions, LLC",Walt Disney Studios Motion Pictures,Peyton Reed,Gabriel Ferrari ,Michael Douglas,Paul Rudd,null
Ant-Man,2015,Broadway between Powell and Davis,Driving shots,"PYM Particles Productions, LLC",Walt Disney Studios Motion Pictures,Peyton Reed,Gabriel Ferrari ,Michael Douglas,Paul Rudd,null
Ant-Man,2015,Columbus between Bay and Washington,Driving shots,"PYM Particles Productions, LLC",Walt Disney Studios Motion Pictures,Peyton Reed,Gabriel Ferrari ,Michael Douglas,Paul Rudd,null
Ant-Man,2015,Pine between Kearney and Davis,Driving shots,"PYM Particles Productions, LLC",Walt Disney Studios Motion Pictures,Peyton Reed,Gabriel Ferrari ,Michael Douglas,Paul Rudd,null
Ant-Man,2015,Market between Stuart and Van Ness,Driving shots,"PYM Particles Productions, LLC",Walt Disney Studios Motion Pictures,Peyton Reed,Gabriel Ferrari ,Michael Douglas,Paul Rudd,null
Ant-Man,2015,Grant between Bush and Broadway,Driving shots,"PYM Particles Productions, LLC",Walt Disney Studios Motion Pictures,Peyton Reed,Gabriel Ferrari ,Michael Douglas,Paul Rudd,null
Ant-Man,2015,Intersection of Broadway at Kearney,Driving shots,"PYM Particles Productions, LLC",Walt Disney Studios Motion Pictures,Peyton Reed,Gabriel Ferrari ,Michael Douglas,Paul Rudd,null
Ant-Man,2015,Intersection of California at Polk,Driving shots,"PYM Particles Productions, LLC",Walt Disney Studios Motion Pictures,Peyton Reed,Gabriel Ferrari ,Michael Douglas,Paul Rudd,null
Ant-Man,2015,"Treasure Island, Building #1, Ave of the Palms",Aerial and exterior shots,"PYM Particles Productions, LLC",Walt Disney Studios Motion Pictures,Peyton Reed,Gabriel Ferrari ,Michael Douglas,Paul Rudd,null
Around the Fire,1998,Ocean Beach,"On Jan. 25, 1878, the King Philip ship crashed in Ocean Beach. Occasionally, the ship's wreckage may be found on the beach-- most recently it was seen in 2007. ",Paradigm Studio,Ardustry Home Entertainment,John Jacobsen,John Comerford,Tara Reid,null,null
Attack of the Killer Tomatoes,1978,Hyde Street Cable Car,SF Cable Cars are the only moving National Historical Landmark.,Four Square Productions,NAI Entertainment,John DeBello,John DeBello,David Miller,null,null
Chance Season 2,2017,Lombard St between Hyde and Larkin St,null,TVM Productions Inc.,Hulu,Rozann Dawson,Alexandra Cunningham,Hugh Laurie,Greta Lee,Ethan Suplee
Basic Instinct,1992,Yerba Buena Center for the Arts,null,Carolco Pictures,TriStar Pictures,Paul Verhoeven,Joe Eszterhas,Michael Douglas,Sharon Stone,George Dzundza
Basic Instinct,1992,Transbay Terminal (Mission Street at 1st Street),"Built in 1939, the Terminal linked San Francisco, the East Bay, and Sacramento by rail for the first time.",Carolco Pictures,TriStar Pictures,Paul Verhoeven,Joe Eszterhas,Michael Douglas,Sharon Stone,George Dzundza
Basic Instinct,1992,Tosca Café (242 Columbus Avenue),null,Carolco Pictures,TriStar Pictures,Paul Verhoeven,Joe Eszterhas,Michael Douglas,Sharon Stone,George Dzundza
Basic Instinct,1992,"Steinhart Aquarium (California Academy of Sciences, Golden Gate Park)","The Steinhart Aquarium is home to over 38,000 animals, which represent more than 900 species. ",Carolco Pictures,TriStar Pictures,Paul Verhoeven,Joe Eszterhas,Michael Douglas,Sharon Stone,George Dzundza
Basic Instinct,1992,Raw Hide II (280 Seventh Street),null,Carolco Pictures,TriStar Pictures,Paul Verhoeven,Joe Eszterhas,Michael Douglas,Sharon Stone,George Dzundza
Basic Instinct,1992,Pier 7 (The Embarcadero),null,Carolco Pictures,TriStar Pictures,Paul Verhoeven,Joe Eszterhas,Michael Douglas,Sharon Stone,George Dzundza
Basic Instinct,1992,Kearney Street (Telegraph Hill),null,Carolco Pictures,TriStar Pictures,Paul Verhoeven,Joe Eszterhas,Michael Douglas,Sharon Stone,George Dzundza
Basic Instinct,1992,Hall of Justice (850 Bryant Street),null,Carolco Pictures,TriStar Pictures,Paul Verhoeven,Joe Eszterhas,Michael Douglas,Sharon Stone,George Dzundza
Basic Instinct,1992,2930 Vallejo Street,null,Carolco Pictures,TriStar Pictures,Paul Verhoeven,Joe Eszterhas,Michael Douglas,Sharon Stone,George Dzundza
Basic Instinct,1992,Chinatown,"First established in the mid-19th Century, SF's Chinatown is the oldest and largest Chinatown in the US.",Carolco Pictures,TriStar Pictures,Paul Verhoeven,Joe Eszterhas,Michael Douglas,Sharon Stone,George Dzundza
Basic Instinct,1992,Gibb Street (Chinatown),null,Carolco Pictures,TriStar Pictures,Paul Verhoeven,Joe Eszterhas,Michael Douglas,Sharon Stone,George Dzundza
Basic Instinct,1992,1158-70 Montgomery Street,null,Carolco Pictures,TriStar Pictures,Paul Verhoeven,Joe Eszterhas,Michael Douglas,Sharon Stone,George Dzundza
Basic Instinct,1992,2104 Broadway,null,Carolco Pictures,TriStar Pictures,Paul Verhoeven,Joe Eszterhas,Michael Douglas,Sharon Stone,George Dzundza
Chance Season 2,2017,"Taylor St, north of Jefferson St to end",null,TVM Productions Inc.,Hulu,Rozann Dawson,Alexandra Cunningham,Hugh Laurie,Greta Lee,Ethan Suplee
Bedazzled,2000,1155 Filbert Street at Hyde,null,Twentieth Century Fox Film Corp.,Twentieth Century Fox Film Corp.,Harold Ramis,Harold Ramis,Brendan Fraser,Elizabeth Hurley,null
Bedazzled,2000,"Washington Square Park (Filbert, between Stockton and Powell)",null,Twentieth Century Fox Film Corp.,Twentieth Century Fox Film Corp.,Harold Ramis,Harold Ramis,Brendan Fraser,Elizabeth Hurley,null
Blue Jasmine,2013,5546 Geary Ave,null,Perdido Productions,Sony Pictures Classics,Woody Allen,Woody Allen,Cate Blanchett,Alec Baldwin,Peter Sarsgaard
Bedazzled,2000,Vaillancourt Fountain (Justin Herman Plaza),"Installed in 1975, the Vaillancourt Fountain is officially titled, ""Québec Libre!"". The night before the sculpture's inauguration, artist Armand Vaillancourt inscribed ""Québec libre!"" in red letters on the sculpture. The next day when he noticed that the note had been erased, Vaillancourt jumped on the statue to re-inscribe his message. ",Twentieth Century Fox Film Corp.,Twentieth Century Fox Film Corp.,Harold Ramis,Harold Ramis,Brendan Fraser,Elizabeth Hurley,null
Bedazzled,2000,Montgomery & Market Streets,null,Twentieth Century Fox Film Corp.,Twentieth Century Fox Film Corp.,Harold Ramis,Harold Ramis,Brendan Fraser,Elizabeth Hurley,null
Bedazzled,2000,City Hall,"The dome of SF's City Hall is almost a foot taller than that of the US Capitol Building. In 1954, Joe DiMaggio and Marilyn Monroe married at the Beaux Arts-style building.",Twentieth Century Fox Film Corp.,Twentieth Century Fox Film Corp.,Harold Ramis,Harold Ramis,Brendan Fraser,Elizabeth Hurley,null
Bee Season,2005,null,null,Bee Season Productions,Fox Searchlight Pictures,Scott McGehee,David Siegel,Richard Gere,Juliette Binoche,null
Bicentennial Man,1999,City Hall,"The dome of SF's City Hall is almost a foot taller than that of the US Capitol Building. In 1954, Joe DiMaggio and Marilyn Monroe married at the Beaux Arts-style building.",1492 Pictures,Buena Vista Pictures,Chris Columbus,Nicholas Kazan,Robin Williams,null,null
Bicentennial Man,1999,Golden Gate Bridge,"With 23 miles of ladders and 300,000 rivets in each tower, the Golden Gate Bridge was the world's longest span when it opened in 1937.",1492 Pictures,Buena Vista Pictures,Chris Columbus,Nicholas Kazan,Robin Williams,null,null
Bicentennial Man,1999,Treasure Island,"An artificial island, Treasure Island was created for the 1939 Golden Gate International Exposition, and is named after the novel by Robert Louis Stevenson, a one-time San Francisco resident.",1492 Pictures,Buena Vista Pictures,Chris Columbus,Nicholas Kazan,Robin Williams,null,null
Bicentennial Man,1999,"Postcard Row, Alamo Square, Hayes Valley",The 6 Victorian homes across from Alamo Square Park are among the few Victorians to survive the Great Fire.,1492 Pictures,Buena Vista Pictures,Chris Columbus,Nicholas Kazan,Robin Williams,null,null
Bicentennial Man,1999,Grace Cathedral Episcopal Church (1100 California Street),Grace Cathedral Episcopal Church is the West Coast's largest Episcopalian cathedral.,1492 Pictures,Buena Vista Pictures,Chris Columbus,Nicholas Kazan,Robin Williams,null,null
Big Eyes,2014,Nobles Alley,null,Blink & Wink Productions,Weinstein Company,Tim Burton,Scott Alexander,Amy Adams,Krysten Ritter,Christoph Waltz
Big Eyes,2014,Caffe Trieste,null,Blink & Wink Productions,Weinstein Company,Tim Burton,Scott Alexander,Amy Adams,Krysten Ritter,Christoph Waltz
Big Eyes,2014,Palace of Fine Arts,null,Blink & Wink Productions,Weinstein Company,Tim Burton,Scott Alexander,Amy Adams,Krysten Ritter,Christoph Waltz
Big Eyes,2014,1101 Filbert St. ,null,Blink & Wink Productions,Weinstein Company,Tim Burton,Scott Alexander,Amy Adams,Krysten Ritter,Christoph Waltz
Big Eyes,2014,Saints Peter & Paul Church,null,Blink & Wink Productions,Weinstein Company,Tim Burton,Scott Alexander,Amy Adams,Krysten Ritter,Christoph Waltz
Big Eyes,2014,Green St. & Grant Ave.,null,Blink & Wink Productions,Weinstein Company,Tim Burton,Scott Alexander,Amy Adams,Krysten Ritter,Christoph Waltz
Big Eyes,2014,Filbert St. & Leavenworth,null,Blink & Wink Productions,Weinstein Company,Tim Burton,Scott Alexander,Amy Adams,Krysten Ritter,Christoph Waltz
Big Eyes,2014,Pine St. & Grant,null,Blink & Wink Productions,Weinstein Company,Tim Burton,Scott Alexander,Amy Adams,Krysten Ritter,Christoph Waltz
Big Eyes,2014,Way Faire Inn on Leidesdorff,null,Blink & Wink Productions,Weinstein Company,Tim Burton,Scott Alexander,Amy Adams,Krysten Ritter,Christoph Waltz
Big Eyes,2014,Harry's Bar on Fillmore,null,Blink & Wink Productions,Weinstein Company,Tim Burton,Scott Alexander,Amy Adams,Krysten Ritter,Christoph Waltz
Big Sur,2013,"Tosca Café (242 Columbus Avenue, North Beach)",null,3311 Productions,null,Michael Polish,Jack Kerouac & Michael Polish,Josh Lucas,Kate Bosworth,Stana Katic
Chance Season 2,2017,California between Mason and Taylor St,null,TVM Productions Inc.,Hulu,Rozann Dawson,Alexandra Cunningham,Hugh Laurie,Greta Lee,Ethan Suplee
Chance Season 2,2017,Coit Tower,null,TVM Productions Inc.,Hulu,Rozann Dawson,Alexandra Cunningham,Hugh Laurie,Greta Lee,Ethan Suplee
Beautiful Boy,2018,"Olympic Flame Café, 555 Geary St",null,Big Indie Pictures,Amazon Studios,Felix van Groeningen,Luke Davies,Steve Carell,Timothee Chalamet,Maura Tierney
Blue Jasmine,2013,Jones & Pacific,null,Perdido Productions,Sony Pictures Classics,Woody Allen,Woody Allen,Cate Blanchett,Alec Baldwin,Peter Sarsgaard
Blue Jasmine,2013,Pacific & Divisadero,null,Perdido Productions,Sony Pictures Classics,Woody Allen,Woody Allen,Cate Blanchett,Alec Baldwin,Peter Sarsgaard
Blue Jasmine,2013,Lombard & Hyde,null,Perdido Productions,Sony Pictures Classics,Woody Allen,Woody Allen,Cate Blanchett,Alec Baldwin,Peter Sarsgaard
Blue Jasmine,2013,2898 Broadway,null,Perdido Productions,Sony Pictures Classics,Woody Allen,Woody Allen,Cate Blanchett,Alec Baldwin,Peter Sarsgaard
Blue Jasmine,2013,Motel Capri,null,Perdido Productions,Sony Pictures Classics,Woody Allen,Woody Allen,Cate Blanchett,Alec Baldwin,Peter Sarsgaard
Blue Jasmine,2013,Marina Green,null,Perdido Productions,Sony Pictures Classics,Woody Allen,Woody Allen,Cate Blanchett,Alec Baldwin,Peter Sarsgaard
Blue Jasmine,2013,Ocean Beach at Lincoln,null,Perdido Productions,Sony Pictures Classics,Woody Allen,Woody Allen,Cate Blanchett,Alec Baldwin,Peter Sarsgaard
Blue Jasmine,2013,Heald College,null,Perdido Productions,Sony Pictures Classics,Woody Allen,Woody Allen,Cate Blanchett,Alec Baldwin,Peter Sarsgaard
