Title,ReleaseYear,Locations,FunFacts,ProductionCompany,Distributor,Director,Writer,Actor1,Actor2,Actor3
A View to a Kill,1985,City Hall,"The dome of SF's City Hall is almost a foot taller than that of the US Capitol Building. In 1954, Joe DiMaggio and Marilyn Monroe married at the Beaux Arts-style building.",Metro-Goldwyn Mayer,MGM/UA Entertainment Company,John Glen,Richard Maibaum,Roger Moore,Christopher Walken,Tanya Roberts
The Dead Pool,1988,Pierce & California Streets (Pacific Heights),null,Warner Bros. Pictures,Warner Bros. Pictures,Buddy Van Horn,Harry Julian Fink,Clint Eastwood,Liam Neeson,Patricia Clarkson
A Jitney Elopement,1915,Golden Gate Park,"During San Francisco's Gold Rush era, the Park was part of an area designated as the ""Great Sand Waste"". ",The Essanay Film Manufacturing Company,General Film Company,Charles Chaplin,Charles Chaplin,Charles Chaplin,Edna Purviance,null
Edtv,1999,"Center for the Arts, Yerba Buena Gardens (701 Mission Street)",null,Imagine Entertainment,MCA / Universal Pictures,Ron Howard,Lowell Ganz,Matthew McConaughey,Jenna Elfman,null
Live Nude Girls Unite,2000,Lusty Lady Bar (North Beach),null,Constant Communication,First Run Features,Vicky Funari,Vicky Funari,null,null,null
"Play it Again, Sam",1972,Balboa at 22nd Avenue,null,Paramount Pictures,Paramount Pictures,Herbert Ross,Woody Allen,Woody Allen,Diane Keaton,Tony Roberts
Time After Time,1979,100 Block of Union Street (Cow Hollow),null,Orion Pictures Corp.,Columbia Broadcasting System (CBS),Nicholas Meyer,Karl Alexander,Malcolm McDowell,Mary Steenburgen,David Warner
The Game,1997,Ritz-Carlton Hotel (600 Stockton Street),null,Polygram Filmed Entertainment,Polygram Filmed Entertainment,David Fincher,John Brancato,Michael Douglas,Sean Penn,Deborah Kara Unger
Jagged Edge,1985,City Hall,"The dome of SF's City Hall is almost a foot taller than that of the US Capitol Building. In 1954, Joe DiMaggio and Marilyn Monroe married at the Beaux Arts-style building.",Columbia Pictures Corp.,Columbia Pictures,Richard Marquand,Joe Eszterhas,Glenn Close,Jeff Bridges,Peter Coyote
Nine Months,1995,60 Spear Street,null,1492 Pictures,Twentieth Century Fox Film Corp.,Chris Columbus,Chris Columbus,Hugh Grant,Julianne Moore,Robin Williams
Freebie and the Bean,1974,Candlestick Park (602 Jamestown Ave.),"Then Vice President Richard Nixon threw out the first pitch when Candlestick opened in 1960. On August 29, 1966, The Beatles played their last concert for paying fans at Candlestick Park.",Warner Bros. Pictures,American Broadcasting Company (ABC),Richard Rush,Robert Kaufman,Alan Arkin,James Caan,Loretta Swit
Star Trek IV: The Voyage Home,1986,Kearny & Pacific Streets,null,Paramount Pictures,Paramount Pictures,Leonard Nimoy,Steve Meerson,William Shatner,Leonard Nimoy,George Takei
The Presidio,1988,"Fort Point (Presidio, Golden Gate National Recreation Area)","Built in 1853, Fort Point is the only West Coast fort built by the Union Army. Though the Confederate army planned to attack San Francisco, the commanding Confederate general learned that the war had ended while end route to SF.",Paramount Pictures,Paramount Pictures,Peter Hyams,Larry Ferguson,Sean Connery,Mark Harmon,Meg Ryan
The Game,1997,Merchant Exchange Building (465 California Street),null,Polygram Filmed Entertainment,Polygram Filmed Entertainment,David Fincher,John Brancato,Michael Douglas,Sean Penn,Deborah Kara Unger
Foul Play,1978,Fort Mason (Golden Gate National Recreation Area),"Constructed in 1864 as a coastal defense site, Fort Mason went on to serve as an army post for more than 100 years.",Paramount Pictures,Paramount Pictures,Colin Higgins,Colin Higgins,Goldie Hawn,Chevy Chase,Burgess Meredith
Pleasure of His Company,1961,Grace Cathedral Episcopal Church (1100 California Street),Grace Cathedral Episcopal Church is the West Coast's largest Episcopalian cathedral.,Perlsea Company,Paramount Pictures,George Seaton,Samuel A. Taylor,Fred Astaire,Debbie Reynolds,Lilli Palmer
Invasion of the Body Snatchers,1978,1227 Montgomery Street (Telegraph Hill),null,Solofilm,United Artists,Philip Kaufman,Jack Finney,Donald Sutherland,Jeff Goldblum,Brooke Adams
Freebie and the Bean,1974,Twin Peaks,"The 2nd highest point in SF after Mt. Davidson, Twin Peaks sit at the geographic center of SF. The native Ohlone people called the area ""called the area “Los Pechos de la Chola” or ""Breasts of the Indian Maiden,"" but in the 19th Century when America took over the area, it was renamed ""Twin Peaks"".",Warner Bros. Pictures,American Broadcasting Company (ABC),Richard Rush,Robert Kaufman,Alan Arkin,James Caan,Loretta Swit
Chu Chu and the Philly Flash,1981,"Fairmont Hotel (950 Mason Street, Nob Hill)","In 1945 the Fairmont hosted the United Nations Conference on International Organization as delegates arrived to draft a charter for the organization. The U.S. Secretary of State, Edward Stettinius drafted the charter in the hotel's Garden Room.",Melvin Simon Productions,Columbia Broadcasting System (CBS),David Lowell Rich,Barbara Dana,Alan Arkin,Carol Burnett,null
Invasion of the Body Snatchers,1978,Hamlin Hotel (385 Eddy Street),null,Solofilm,United Artists,Philip Kaufman,Jack Finney,Donald Sutherland,Jeff Goldblum,Brooke Adams
Magnum Force,1973,Embarcadero Freeway,demolished,The Malpaso Company,Warner Bros. Pictures,Ted Post,John Milius,Clint Eastwood,Hal Holbrook,Mitchell Ryan
Harold and Maude,1971,Sutro Baths (Point Lobos Avenue),null,Mildred Lewis and Colin Higgins Productions,Paramount Pictures,Hal Ashby,Colin Higgins,Ruth Gordon,Bud Cort,null
Hemingway & Gelhorn,2011,Muni Metro East (501 Cesar Chavez),null,"Attaboy Films, For Whom Productions, Home Box Office (HBO)",Home Box Office (HBO),Philip Kaufman,Jerry Stahl & Barbara Turner,Nicole Kidman,Clive Owen,null
Pal Joey,1957,"Spreckels Mansion (2080 Washington Street, Pacific Heights)",null,Columbia Pictures Corporation,Columbia Pictures,George Sidney,Dorothy Kingsley,Rita Hayworth,Frank Sinatra,Kim Novak
Twisted,2004,Vesuvio Café (255 Columbus Avenue),Jack Kerouac was a regular at the café.,Paramount Pictures,Paramount Pictures,Philip Kaufman,Sarah Thorp,Ashley Judd,Samuel L. Jackson,null
Bullitt,1968,Bay Bridge,"Before opening in 1936, the bridge was blessed by Cardinal Secretary of State Eugenio Pacelli, who later became Pope Pius XII. ","Warner Brothers / Seven Arts
Seven Arts",Warner Brothers,Peter Yates,Alan R. Trustman,Steve McQueen,Jacqueline Bisset,Robert Vaughn
The Dead Pool,1988,Pierce St. & Golden Gate Avenue (Hayes Valley),null,Warner Bros. Pictures,Warner Bros. Pictures,Buddy Van Horn,Harry Julian Fink,Clint Eastwood,Liam Neeson,Patricia Clarkson
Sudden Impact,1983,"Near Point Lobos, El Camino Del Mar ",null,Warner Bros. Pictures,Warner Bros. Pictures,Clint Eastwood,Harry Julian Fink,Clint Eastwood,Sondra Locke,null
The Love Bug,1968,100 Block of Lombard Street,Lombard Street is not actually the most crooked in SF. That honor goes to Potrero Hill's Vermont Street between 22nd and 23rd.,Walt Disney Productions,Buena Vista Distribution,Robert Stevenson,Bill Walsh,Dean Jones,Michele Lee,David Tomlinson
Shadow of the Thin Man,1941,Bay Bridge,"Before opening in 1936, the bridge was blessed by Cardinal Secretary of State Eugenio Pacelli, who later became Pope Pius XII. ",Metro-Goldwyn Mayer,Metro-Goldwyn Mayer,W.S. Van Dyke,Harry Kurnitz,William Powell,Myrna Loy,Barry Nelson
Star Trek IV: The Voyage Home,1986,North Beach,null,Paramount Pictures,Paramount Pictures,Leonard Nimoy,Steve Meerson,William Shatner,Leonard Nimoy,George Takei
Thief of Hearts,1984,null,null,Paramount Pictures,Paramount Pictures,Douglas Day Stewart,Douglas Day Stewart,Steven Bauer ,David Caruso,Barbara Williams
Getting Even with Dad,1994,140 Maiden Lane,null,Metro-Goldwyn-Mayer (MGM),Metro-Goldwyn-Mayer (MGM),Howard Deutch,Tom S. Parker,Macaulay Culkin,Ted Danson,null
Dirty Harry,1971,San Francisco Drydock (20th and Illinois Streets),null,The Malpaso Company,Warner Brothers,Don Siegel,Harry Julian Fink,Clint Eastwood,Harry Guardino,null
Vertigo,1958,Mission San Juan Bautista (2nd & Mariposa Streets),null,Alfred J. Hitchcock Productions,Paramount Pictures,Alfred Hitchcock,Alec Coppel,James Stewart,Kim Novak,Barbara Bel Geddes
Fathers' Day,1997,null,null,Northern Lights Entertainment,Columbia Broadcasting System,Ivan Reitman,Lowell Ganz,Robin Williams,Billy Crystal,null
Jade,1995,Fior d' Italia (601 Union Street at Stockton),null,Paramount Pictures,Paramount Pictures,William Friedkin,Joe Eszterhas,David Caruso,Linda Fiorentino,Chazz Palminteri
I Remember Mama,1948,Grant Avenue (North Beach),null,RKO Radio Pictures,RKO Radio Pictures,George Stevens,DeWitt Bodeen,Irene Dunne,Barbara Bel Geddes,Oskar Homolka
Vertigo,1958,Ernie's Restaurant (847 Montgomery Street),"Called the ""Essex Club"" in the film.",Alfred J. Hitchcock Productions,Paramount Pictures,Alfred Hitchcock,Alec Coppel,James Stewart,Kim Novak,Barbara Bel Geddes
Nine Months,1995,"101 Henry Adams Place, 4th Floor",null,1492 Pictures,Twentieth Century Fox Film Corp.,Chris Columbus,Chris Columbus,Hugh Grant,Julianne Moore,Robin Williams
Nine Months,1995,Alamo Square,null,1492 Pictures,Twentieth Century Fox Film Corp.,Chris Columbus,Chris Columbus,Hugh Grant,Julianne Moore,Robin Williams
D.O.A,1950,Southern Pacific Memorial Hospital (1400 Fell Street),null,Cardinal Pictures,United Artists,Rudolph Mate,Russell Rouse,Edmond O'Brien,Pamela Britton,Luther Adler
Invasion of the Body Snatchers,1978,Pier 33 (Embarcadero),null,Solofilm,United Artists,Philip Kaufman,Jack Finney,Donald Sutherland,Jeff Goldblum,Brooke Adams
Crackers,1984,24th Street between Mission Street and Potrero Avenue,null,Universal Pictures,Universal Pictures,Louis Malle,Jeffrey Fiskin,Donald Sutherland,Jack Warden,Sean Penn
Foul Play,1978,Sutter & Buchannan Streets,null,Paramount Pictures,Paramount Pictures,Colin Higgins,Colin Higgins,Goldie Hawn,Chevy Chase,Burgess Meredith
The Enforcer,1976,"Lefty O' Doul Drawbridge/ 3rd Street Bridge (3rd Street, China Basin)","This is SF's only drawbridge, and was named after Francis Joseph ""Lefty"" O'Doul, a local baseball hero.",Warner Bros. Pictures,Warner Bros. Pictures,James Fargo,Stirling Silliphant,Clint Eastwood,Tyne Daly,Harry Guardino
Dim Sum: A Little Bit of Heart,1985,Chinatown,"First established in the mid-19th Century, SF's Chinatown is the oldest and largest Chinatown in the US.",CIM,Orion Classics,Wayne Wang,Terrel Seltzer,Laureen Chew,Kim Chew,Victor Wong
Experiment in Terror,1962,"Sheraton Palace Hotel (2 Montgomery Street, Financial District)","The hotel was destroyed in the 1906 earthquake and fire, had to be rebuilt, and was reopened in 1909. ",Columbia Pictures Corporation,Columbia Pictures,Blake Edwards,The Gordons,Glenn Ford,Lee Remick,Stefanie Powers
The Rock,1996,Alcatraz Island,Alcatraz Island was a military fort before it became a prison.,Hollywood Pictures,Buena Vista Pictures,Michael Bay,David Weisberg,Sean Connery,Nicolas Cage,null
The Last of the Gladiators,1988,null,null,Twin Tower Enterprises,Evel Videos,Martin Jay Sadoff,Martin Jay Sadoff,Evel Knievel,null,null
Babies,2010,null,null,Canal+,Focus Features,Thomas Balmes,Thomas Balmes,Bayar,Hattie,null
Invasion of the Body Snatchers,1978,Transamerica Building (600 Montgomery Street at Clay),"The Pyramid was the tallest skyscraper west of the Mississippi from 1972-1974, until it was surpassed by Los Angeles' Aon Center. ",Solofilm,United Artists,Philip Kaufman,Jack Finney,Donald Sutherland,Jeff Goldblum,Brooke Adams
Vertigo,1958,"Fairmont Hotel (950 Mason Street, Nob Hill)","In 1945 the Fairmont hosted the United Nations Conference on International Organization as delegates arrived to draft a charter for the organization. The U.S. Secretary of State, Edward Stettinius drafted the charter in the hotel's Garden Room.",Alfred J. Hitchcock Productions,Paramount Pictures,Alfred Hitchcock,Alec Coppel,James Stewart,Kim Novak,Barbara Bel Geddes
Mother,1996,"Fairmont Hotel (950 Mason Street, Nob Hill)","In 1945 the Fairmont hosted the United Nations Conference on International Organization as delegates arrived to draft a charter for the organization. The U.S. Secretary of State, Edward Stettinius drafted the charter in the hotel's Garden Room.",Paramount Pictures,Paramount Pictures,Albert Brooks,Albert Brooks,Albert Brooks,Debbie Reynolds,null
Invasion of the Body Snatchers,1978,City Hall,"The dome of SF's City Hall is almost a foot taller than that of the US Capitol Building. In 1954, Joe DiMaggio and Marilyn Monroe married at the Beaux Arts-style building.",Solofilm,United Artists,Philip Kaufman,Jack Finney,Donald Sutherland,Jeff Goldblum,Brooke Adams
Foul Play,1978,Montgomery & Pine Streets (Financial District),null,Paramount Pictures,Paramount Pictures,Colin Higgins,Colin Higgins,Goldie Hawn,Chevy Chase,Burgess Meredith
Star Trek VI: The Undiscovered Country,1991,Golden Gate Bridge,"With 23 miles of ladders and 300,000 rivets in each tower, the Golden Gate Bridge was the world's longest span when it opened in 1937.",Paramount Pictures,Paramount Pictures,Nicholas Meyer,Nimoy,William Shatner,Leonard Nimoy,George Takei
The Towering Inferno,1974,"Bank of America Building (555 California Street, Financial District)","The Bank of America Building was the tallest building on the West Coast from 1969-1972, when it was surpassed by the TransAmerica Pyramid. Today, the Bank of America building is the 5th tallest building on the West Coast.",Irwin Allen Productions,Twentieth Century - Fox,John Guillermin,Stirling Silliphant,Steve McQueen,Paul Newman,William Holden
Vertigo,1958,York Hotel (940 Sutter Street),null,Alfred J. Hitchcock Productions,Paramount Pictures,Alfred Hitchcock,Alec Coppel,James Stewart,Kim Novak,Barbara Bel Geddes
The Dead Pool,1988,"Mirant Energy, LLC (1301 Illinois Street, The Dogpatch)",null,Warner Bros. Pictures,Warner Bros. Pictures,Buddy Van Horn,Harry Julian Fink,Clint Eastwood,Liam Neeson,Patricia Clarkson
Foul Play,1978,"Hayes Valley Care (601 Laguna Street, Hayes Valley)",null,Paramount Pictures,Paramount Pictures,Colin Higgins,Colin Higgins,Goldie Hawn,Chevy Chase,Burgess Meredith
The Presidio,1988,Montgomery & Vallejo Streets (Telegraph Hill),null,Paramount Pictures,Paramount Pictures,Peter Hyams,Larry Ferguson,Sean Connery,Mark Harmon,Meg Ryan
Beaches,1988,null,null,Silver Screen Partners IV,Columbia Broadcasting System,Garry Marshall,Mary Agnes Donoghue,Bette Midler,Barbara Hershey,John Heard
Time After Time,1979,Hyatt Regency Hotel (5 Embarcadero Center),null,Orion Pictures Corp.,Columbia Broadcasting System (CBS),Nicholas Meyer,Karl Alexander,Malcolm McDowell,Mary Steenburgen,David Warner
Time After Time,1979,Lombard & Broderick Streets (Marina District),null,Orion Pictures Corp.,Columbia Broadcasting System (CBS),Nicholas Meyer,Karl Alexander,Malcolm McDowell,Mary Steenburgen,David Warner
Vertigo,1958,Conservatory of Flowers (Golden Gate Park),"The Conservatory, unveiled in 1879, is the oldest public conservatory in the Western Hemisphere.",Alfred J. Hitchcock Productions,Paramount Pictures,Alfred Hitchcock,Alec Coppel,James Stewart,Kim Novak,Barbara Bel Geddes
The Net,1995,Montgomery & Market Streets,null,Columbia Pictures Corp.,Columbia Pictures,Irwin Winkler,John Brancato,Sandra Bullock,Jeremy Northam,null
Sudden Fear,1952,The Tamalpais Building (1201 Greenwich Street at Hyde),null,Joseph Kaufmann Pictures,RKO Pictures,David Miller,Lenore J. Coffee,Joan Crawford,Jack Palance,Gloria Grahame
48 Hours,1982,null,null,Paramount Pictures,Paramount Pictures,Walter Hill,Walter Hill,Nick Nolte,Eddie Murphy,Annette O'Toole
The Enforcer,1976,23rd & Capp Streets (Mission District),null,Warner Bros. Pictures,Warner Bros. Pictures,James Fargo,Stirling Silliphant,Clint Eastwood,Tyne Daly,Harry Guardino
Dim Sum: A Little Bit of Heart,1985,"Li Po (916 Grant Avenue at Washington, Chinatown)",null,CIM,Orion Classics,Wayne Wang,Terrel Seltzer,Laureen Chew,Kim Chew,Victor Wong
Dr. Dolittle 2,2001,Hyde Street & Lombard Street,null,Twentieth Century Fox Film Corp.,Twentieth Century Fox Film Corp.,Steve Carr,Larry Levin,Eddie Murphy,Kristen Wilson,null
By Hook or By Crook,2001,"Department of Public Health (101 Grove Street at Polk, Civic Center)",null,Steakhaus Productions,Artistic License,Harriet Dodge & Silas Howard,Harriet Dodge & Silas Howard,Silas Howard,null,null
The Dead Pool,1988,Folsom & Essex Streets,null,Warner Bros. Pictures,Warner Bros. Pictures,Buddy Van Horn,Harry Julian Fink,Clint Eastwood,Liam Neeson,Patricia Clarkson
Woman on the Run,1950,1801 Laguna at Bush,null,Fidelity Pictures Corporation,Universal Pictures,Norman Foster,Norman Foster,Ann Sheridan,Dennis O'Keefe,Robert Keith
Vertigo,1958,Park Hill Sanatorium (351 Buena Vista Avenue East),This location is now a condominium complex.,Alfred J. Hitchcock Productions,Paramount Pictures,Alfred Hitchcock,Alec Coppel,James Stewart,Kim Novak,Barbara Bel Geddes
Gentleman Jim,1942,The Barbary Coast,"The Barbary Coast was a red-light district that was largely destroyed in the 1906 earthquake. Though some of the establishments were rebuilt after the earthquake, an anti-vice campaign put the establishments out of business.",Warner Bros. Pictures,Warner Bros. Pictures,Raoul Walsh,Vincent Lawrence,Errol Flynn,Alexis Smith,Jack Carson
The Game,1997,301 Howard Street,null,Polygram Filmed Entertainment,Polygram Filmed Entertainment,David Fincher,John Brancato,Michael Douglas,Sean Penn,Deborah Kara Unger
Time After Time,1979,Lombard & Laguna Streets (Marina District),null,Orion Pictures Corp.,Columbia Broadcasting System (CBS),Nicholas Meyer,Karl Alexander,Malcolm McDowell,Mary Steenburgen,David Warner
It Came From Beneath the Sea,1955,Hunters Point,"With 23 miles of ladders and 300,000 rivets in each tower, the Golden Gate Bridge was the world's longest span when it opened in 1937.",Clover Productions,Columbia Pictures,Robert Gordon,George Worthing Yates,Kenneth Tobey,Faith Domergue,Donald Curtis
Dirty Harry,1971,Dante Building (1606 Stockton Street at Union),null,The Malpaso Company,Warner Brothers,Don Siegel,Harry Julian Fink,Clint Eastwood,Harry Guardino,null
The Conversation,1974,Financial District,null,American Zoetrope,Paramount Pictures,Francis Ford Coppola,Francis Ford Coppola,Gene Hackman,John Cazale,Allen Garfield
Nine Months,1995,Jones Street at Bush,null,1492 Pictures,Twentieth Century Fox Film Corp.,Chris Columbus,Chris Columbus,Hugh Grant,Julianne Moore,Robin Williams
Foul Play,1978,Octavia & Hayes Streets (Hayes Valley),null,Paramount Pictures,Paramount Pictures,Colin Higgins,Colin Higgins,Goldie Hawn,Chevy Chase,Burgess Meredith
Just One Night,2000,Ferry Building,"Every hour and half-hour, the clock bell atop the Ferry Building chimes portions of the Westminster Quarters.",Panoptic Pictures,First Look International,Alan Jacobs,Alan Jacobs,Timothy Hutton,Maria Grazia Cucinotta,null
The Wedding Planner,2001,"The Music Concourse (Martin Luther King, Jr. Drive, Golden Gate Park)",Golden Gate Park is similar in shape but 20% larger than New York's Central Park.,Columbia Pictures,Sony Pictures Entertainment,Adam Shankman,Pamela Falk,Jennifer Lopez,Matthew McConaughey,null
Marnie,1964,"On Board the SS President Cleveland, docked at Pier 50",null,Universal Pictures,Universal Pictures,Alfred Hitchcock,Jay Presson Allen,Tippi Hedren,Sean Connery,Martin Gabel
Fearless,1993,Varennes Alley between Filbert and Union,null,Spring Creek Productions,Warner Bros. Pictures,Peter Weir,Rafael Yglesias,Jeff Bridges,Isabella Rosellini,Rosie Perez
Mona Lisa Smile,2003,null,null,Revolution Studios,Columbia Pictures,Mike Newell,Lawrence Konner,Julia Roberts,Kirsten Dunst,null
Bullitt,1968,Larkin & Chestnut Streets (Russian Hill),null,"Warner Brothers / Seven Arts
Seven Arts",Warner Brothers,Peter Yates,Alan R. Trustman,Steve McQueen,Jacqueline Bisset,Robert Vaughn
Knife Fight,2013,California & Hyde Streets,null,Divisadero Pictures & Knife Fight,Eagle Films,Bill Guttentag,Bill Guttentag & Chris Lehane,Rob Lowe,Julie Bowen,Jamie Chung
The Towering Inferno,1974,"Fairmont Hotel (950 Mason Street, Nob Hill)","In 1945 the Fairmont hosted the United Nations Conference on International Organization as delegates arrived to draft a charter for the organization. The U.S. Secretary of State, Edward Stettinius drafted the charter in the hotel's Garden Room.",Irwin Allen Productions,Twentieth Century - Fox,John Guillermin,Stirling Silliphant,Steve McQueen,Paul Newman,William Holden
Dim Sum: A Little Bit of Heart,1985,San Francisco International Airport,SFO has a museum dedicated to aviation history. ,CIM,Orion Classics,Wayne Wang,Terrel Seltzer,Laureen Chew,Kim Chew,Victor Wong
Nina Takes a Lover,1994,null,null,Alan Jacobs Productions,Columbia TriStar Home Video,Alan Jacobs,Alan Jacobs,Laura San Giacomo,Paul Rhys,null
A View to a Kill,1985,Embarcadero Freeway,"Embarcadero Freeway, which was featured in the film, was demolished in 1989 because of structural damage from the 1989 Loma Prieta Earthquake)",Metro-Goldwyn Mayer,MGM/UA Entertainment Company,John Glen,Richard Maibaum,Roger Moore,Christopher Walken,Tanya Roberts
A View to a Kill,1985,City Hall,"The dome of SF's City Hall is almost a foot taller than that of the US Capitol Building. In 1954, Joe DiMaggio and Marilyn Monroe married at the Beaux Arts-style building.",Metro-Goldwyn Mayer,MGM/UA Entertainment Company,John Glen,Richard Maibaum,Roger Moore,Christopher Walken,Tanya Roberts
A View to a Kill,1985,City Hall,"The dome of SF's City Hall is almost a foot taller than that of the US Capitol Building. In 1954, Joe DiMaggio and Marilyn Monroe married at the Beaux Arts-style building.",Metro-Goldwyn Mayer,MGM/UA Entertainment Company,John Glen,Richard Maibaum,Roger Moore,Christopher Walken,Tanya Roberts
American Graffiti,1973,"Mel's Drive-In (Corner of Van Ness & Mission Street, Mission District)",This restaurant location was demolished; however another Mel's was reopened in 1986 on 3355 Geary Blvd. ,Universal Pictures,Universal Pictures',George Lucas,George Lucas,Richard Dreyfuss,Ron Howard,Paul Le Mat
High Anxiety,1977,"Fort Point (Presidio, Golden Gate National Recreation Area)","Built in 1853, Fort Point is the only West Coast fort built by the Union Army. Though the Confederate army planned to attack San Francisco, the commanding Confederate general learned that the war had ended while end route to SF.",Twentieth Century Fox Film Corporation,Twentieth Century Fox Film Corporation,Mel Brooks,Mel Brooks,Mel Brooks,Madeline Kahn,Cloris Leachman
Dream with the Fishes,1997,Bay Bridge,"Before opening in 1936, the bridge was blessed by Cardinal Secretary of State Eugenio Pacelli, who later became Pope Pius XII. ",3 Ring Circus Films,Sony Pictures Classics,Finn Taylor,Finn Taylor & Jeffrey Brown,David Arquette,Brad Hunt,null
A Smile Like Yours ,1997,Grace Cathedral Episcopal Church (1100 California Street),Grace Cathedral Episcopal Church is the West Coast's largest Episcopalian cathedral.,Paramount Pictures,Paramount Pictures,Keith Samples,Keith Samples & Kevin Meyer,Greg Kinnear,Lauren Holly,null
Time After Time,1979,Palace of Fine Arts (3301 Lyon Street),"The original Palace was built for the 1915 Panama-Pacific Exposition, and completely destroyed in 1964. It was rebuilt in 1965.",Orion Pictures Corp.,Columbia Broadcasting System (CBS),Nicholas Meyer,Karl Alexander,Malcolm McDowell,Mary Steenburgen,David Warner
Star Trek IV: The Voyage Home,1986,"Bessie Charmichael Elementary School (375 Seventh Street, SOMA)",null,Paramount Pictures,Paramount Pictures,Leonard Nimoy,Steve Meerson,William Shatner,Leonard Nimoy,George Takei
Edtv,1999,Palace of Fine Arts (3301 Lyon Street),"The original Palace was built for the 1915 Panama-Pacific Exposition, and completely destroyed in 1964. It was rebuilt in 1965.",Imagine Entertainment,MCA / Universal Pictures,Ron Howard,Lowell Ganz,Matthew McConaughey,Jenna Elfman,null
The Game,1997,City Club (155 Sansome Street),null,Polygram Filmed Entertainment,Polygram Filmed Entertainment,David Fincher,John Brancato,Michael Douglas,Sean Penn,Deborah Kara Unger
Nine Months,1995,Jack Kerouac Alley between Columbus & Grant Streets,null,1492 Pictures,Twentieth Century Fox Film Corp.,Chris Columbus,Chris Columbus,Hugh Grant,Julianne Moore,Robin Williams
Magnum Force,1973,280 Freeway at Pennsylvania and Mariposa Streets,null,The Malpaso Company,Warner Bros. Pictures,Ted Post,John Milius,Clint Eastwood,Hal Holbrook,Mitchell Ryan
Experiment in Terror,1962,The Sea Captain's Chest (Fisherman's Wharf),null,Columbia Pictures Corporation,Columbia Pictures,Blake Edwards,The Gordons,Glenn Ford,Lee Remick,Stefanie Powers
D.O.A,1950,Powell & California Streets,null,Cardinal Pictures,United Artists,Rudolph Mate,Russell Rouse,Edmond O'Brien,Pamela Britton,Luther Adler
The Nightmare Before Christmas,1993,null,null,Touchstone Pictures,Buena Vista Pictures,Henry Selick,Tim Burton,Danny Elfman,Catherine O'Hara,null
Fearless,1993,Folsom Street & Embarcadero,null,Spring Creek Productions,Warner Bros. Pictures,Peter Weir,Rafael Yglesias,Jeff Bridges,Isabella Rosellini,Rosie Perez
Bullitt,1968,20th & Vermont Streets (Potrero Hill),The most crooked street in San Francisco is actually Potrero Hill's Vermont Street between 20th St & 22nd St.,"Warner Brothers / Seven Arts
Seven Arts",Warner Brothers,Peter Yates,Alan R. Trustman,Steve McQueen,Jacqueline Bisset,Robert Vaughn
Take the Money and Run,1969,Bank of America (1455 Stockton Street),null,American Broadcasting Company (ABC),Cinerama Releasing Corporation,Woody Allen,Woody Allen,Woody Allen,Janet Margolin,null
A View to a Kill,1985,Van Ness Avenue,null,Metro-Goldwyn Mayer,MGM/UA Entertainment Company,John Glen,Richard Maibaum,Roger Moore,Christopher Walken,Tanya Roberts
