Title,ReleaseYear,Locations,FunFacts,ProductionCompany,Distributor,Director,Writer,Actor1,Actor2,Actor3
Milk,2008,Grace Cathedral Episcopal Church (1100 California Street),Grace Cathedral Episcopal Church is the West Coast's largest Episcopalian cathedral.,Focus Features,Focus Features,Gus Van Sant,Dustin Lance Black,Sean Penn,Emile Hirsch,null
San Andreas,2015,Broadway and Kearney,null,"Upside Down Productions, Inc.",Warner Bros.,Brad Peyton,Allan Loeb,Dwayne Johnson,null,null
"Murder in the First, Season 2",2015,Harriet Street between Bryant and Brannan Streets,null,Turner North Center Productions,Turner Network Television (TNT),Steven Bochcho,Eric Lodal,Taye Diggs,Kathleen Robertson,Ian Anthony Dale
Chance Season 2,2017,Central St between Haight and Page St,null,TVM Productions Inc.,Hulu,Rozann Dawson,Alexandra Cunningham,Hugh Laurie,Greta Lee,Ethan Suplee
So I Married an Axe Murderer,1993,"1462 Grant Avenue, at Union Street",null,TriStar Pictures,TriStar Pictures,Thomas Schlamme,Robbie Fox,Mike Myers,Nancy Travis,null
So I Married an Axe Murderer,1993,305 Hugo Street,null,TriStar Pictures,TriStar Pictures,Thomas Schlamme,Robbie Fox,Mike Myers,Nancy Travis,null
Cardinal X,2015,1458 33rd Ave.,null,Fire Horse Film Productions LLC,null,Annie Wang,Annie Wang,Annie Q,Francesca Eastwood,Pierson Fode
Nine Months,1995,Pierce Street between Pacific & Green Streets,null,1492 Pictures,Twentieth Century Fox Film Corp.,Chris Columbus,Chris Columbus,Hugh Grant,Julianne Moore,Robin Williams
"Murder in the First, Season 2",2015,Sue Bierman Park,null,Turner North Center Productions,Turner Network Television (TNT),Steven Bochcho,Eric Lodal,Taye Diggs,Kathleen Robertson,Ian Anthony Dale
Petulia,1968,"Japanese Tea Garden, Hagiwara Tea Garden Drive, Golden Gate Park","The Japanese Hagiwara family invented ""Chinese"" fortune cookies in the tea-garden",Warner Brothers / Seven Arts,Warner Brothers / Seven Arts,Richard Lester,Lawrence B. Marcus,Julie Christie,George C. Scott,Richard Chamberlain
Age of Adaline,2015,California @ Montgomery,null,Lionsgate / Sidney Kimmel Entertainment / Lakeshore Entertainment,null,Lee Toland Krieger,J. Mills Goodloe,Blake Lively,Harrison Ford,Ellen Burstyn
Broken-A Modern Love Story,2010,Ina Coolbrith Park (1700 Taylor Street),null,RKW Films,null,Ryan K. Whiting,Ryan K. Whiting,null,null,null
Ballers Season 3,2017,Embarcadero around Rincon Park,null,"Chori Perros Productions, LLC",HBO,Julian Farino,Stephen Levinson,Dwayne Johnson,John David Washington,Omar Benson Miller
Tucker: The Man and His Dream,1988,City Hall,"The dome of SF's City Hall is almost a foot taller than that of the US Capitol Building. In 1954, Joe DiMaggio and Marilyn Monroe married at the Beaux Arts-style building.",Lucasfilm,Paramount Pictures,Francis Ford Coppola,Arnold Schulman,Jeff Bridges,Joan Allen,Marin Landau
Mission (aka City of Bars),2001,Mission Dolores Park (Mission District),"The two land plots that comprise the Park were used as a Jewish cemetery until 1894 when San Francisco prohibited all burials within city limits. The graves were moved to Colma, CA.",NA,NA,Loren Marsh,Loren Marsh,Chris Coburn,null,null
"Budding Prospects, Pilot",2017,500 Cortland Avenue,null,Picrow Streaming Inc.,Amazon,Terry Zwigoff,"Melissa Axelrod, T. C. Boyle (based on the book by)",Adam Rose,Will Sasso,Joel David Moore
Chance- Season 1 ep107,2016,145 Barlett St.,null,TVM Productions,HULU,Alexandra Cunningham and Kem Nunn,Michael Lehmann,Hugh Laurie,Gretchen Mol,Ethan Suplee
"Murder in the First, Season 1",2014,373 Columbus Avenue,null,Turner North Center Productions,Turner Network Television (TNT),Steven Bochcho,Eric Lodal,Taye Diggs,Kathleen Robertson,Ian Anthony Dale
Herbie Rides Again,1974,Sheraton Palace Hotel (639 Market Street),"The hotel was destroyed in the 1906 earthquake and fire, had to be rebuilt, and was reopened in 1909.",Walt Disney Productions,Buena Vista Distribution,Robert Stevenson,Bill Walsh,Helen Hayes,Ken Berry,Stefanie Powers
Steve Jobs,2015,War Memorial Opera House (401 Van Ness Avenue),null,RDF Productions LLC,Universal Pictures,Danny Boyle,Aaron Sorkin,Michael Fassbender,Kate Winslet,Seth Rogen
Summertime,2015,Alamo Square,null,"Creative Monster Productions, Inc.",7 Distribution,Gabriele Muccino,Gabriele Muccino,Jessica Rothe,Scott Bakula,Matilda Anna Ingrid Lutz
Bullitt,1968,Kennedy Hotel (226 Embarcadero at Howard Street),Hotel was destroyed in the 1989 Loma Prieta earthquake. Corporate headquarters for the Gap reside at the location today.,"Warner Brothers / Seven Arts
Seven Arts",Warner Brothers,Peter Yates,Alan R. Trustman,Steve McQueen,Jacqueline Bisset,Robert Vaughn
Etruscan Smile,2017,San Francisco Airport,null,"Po Valley Productions, LLC",TBD,Oded Binnun/ Michel Brezis,"Sarah Bellwood, Michal Lali Kagan, Michael McGowan Amital Stern, Jose Luis Sampedro",Brian Cox,Roseanne Arquette,Thora Birch
GirlBoss,2017,Fillmore and Waller,null,"Hippolyta Productions, LLC",Netflix,"Jamie Babbit, Amanda Brotchie, Steven K. Tsuchida, Christian Ditter, John Riggi",Kay Cannon,Britt Robertson,Ellie Reed,Amanda Rea
Experiment in Terror,1962,2632 Larkin Street at Lombard,null,Columbia Pictures Corporation,Columbia Pictures,Blake Edwards,The Gordons,Glenn Ford,Lee Remick,Stefanie Powers
Dirty Harry,1971,"California Hall (625 Polk Street, Van Ness/Civic Center)",null,The Malpaso Company,Warner Brothers,Don Siegel,Harry Julian Fink,Clint Eastwood,Harry Guardino,null
The Rock,1996,The San Francisco Bay,null,Hollywood Pictures,Buena Vista Pictures,Michael Bay,David Weisberg,Sean Connery,Nicolas Cage,null
Venom,2018,"Huntington Park, Pine/Kearny, Bush/Hyde",null,"L.O.Z. Productions, Inc.","Columbia Pictures, Sony Pictures Releasing",Ruben Fleischer,"Jeff Pinkner, Scott Rosenberg",Tom Hardy,Michelle Wiliams,Riz Ahmed
The Last Black Man in San Francisco,2019,900 Innes Ave,Boat dock,"LBMISF, LLC",A26,Joe Talbot,"Joe Talbot, Jimmie Fails, Rob Richert",Jimmie Fails,Jonathan Majors,Danny Glover
Experiment in Terror,1962,Candlestick Park,"Then Vice President Richard Nixon threw out the first pitch when Candlestick opened in 1960. On August 29, 1966, The Beatles played their last concert for paying fans at Candlestick Park.",Columbia Pictures Corporation,Columbia Pictures,Blake Edwards,The Gordons,Glenn Ford,Lee Remick,Stefanie Powers
"Looking ""Special""",2016,"Li Po Lounge, 916 Grant Avenue",Li Po Cocktail Lounge was one of the Top 10 Dive Bars in San Francisco in 2011 by SF Weekly,"Mission Street Productions, LLC",HBO,Andrew Haigh,Michael Lannan,Jonathan Groff,Frankie Alvarez,Murray Bartlett
Sense8 - Season 2,2016,"The Castro Theater, 429 Castro St.",The theater has an organ which is played before every film showing.,"Unpronounceable Productions, LLC",Netflix,Wachowski Siblings,"J. Michael Straczynski, Wachowiski Siblings",Jamie Clayton,Daryl Hannah,Naveen Andrews
"Looking ""Special""",2016,"Capital Restaurant, 839 Clay Street","Russell Tovey originally auditioned for the role of Patrick, but was unsuccessful. After the show got picked up, the character of Kevin was written with him in mind.","Mission Street Productions, LLC",HBO,Andrew Haigh,Michael Lannan,Jonathan Groff,Frankie Alvarez,Murray Bartlett
The Times of Harvey Milk,1984,The Castro,"From 1910-1920 the Castro was called ""Little Scandinavia"" because of its high concentration of residents of Scandinavian ancestry.",UCLA Film and Television Archive,TC Films International,Rob Epstein,Rob Epstein,Harvey Milk,Harvey Firestein,Anne Kronenberg
Foul Play,1978,430 Vallejo Street (Telegraph Hill),null,Paramount Pictures,Paramount Pictures,Colin Higgins,Colin Higgins,Goldie Hawn,Chevy Chase,Burgess Meredith
"Smile Again, Jenny Lee",2015,Ocean Beach Motel (2690 46th Ave.),null,Carlo Caldana/Marguery Films,null,Carlo Caldana,Linda Demetrick,Craig Tsuyumine,Puneet Prasad,Larry Kitagawa
Jade,1995,Hall of Justice (850 Bryant Street),null,Paramount Pictures,Paramount Pictures,William Friedkin,Joe Eszterhas,David Caruso,Linda Fiorentino,Chazz Palminteri
High Anxiety,1977,Hyatt Regency Hotel (5 Embarcadero Center),null,Twentieth Century Fox Film Corporation,Twentieth Century Fox Film Corporation,Mel Brooks,Mel Brooks,Mel Brooks,Madeline Kahn,Cloris Leachman
The Competition,1980,California Academy of Sciences (Golden Gate Park),"Founded in 1853, 3 years after California joined the United States, the Academy was originally named the California Academy of Natural Sciences and was the first institution of its kind in the United States.",Columbia Pictures Corporation,American Broadcasting Company (ABC),Joel Oliansky,Joel Oliansky,Richard Dreyfuss,Amy Irving,Lee Remick
Time After Time,1979,Lombard & Divisadero Streets (Marina District),null,Orion Pictures Corp.,Columbia Broadcasting System (CBS),Nicholas Meyer,Karl Alexander,Malcolm McDowell,Mary Steenburgen,David Warner
Star Trek II : The Wrath of Khan,1982,Golden Gate Park,null,Paramount Pictures,Paramount Pictures,Nicholas Meyer,Jack B. Sowards,William Shatner,Leonard Nimoy,George Takei
D.O.A,1950,Westin St. Francis Hotel (335 Powell Street),"The hotel was originally supposed to be named the Crocker Hotel, after Charles Founder the railroad magnate who founded it. However, the hotel took the name the St. Francis after one of the earliest Gold Rush hotels.",Cardinal Pictures,United Artists,Rudolph Mate,Russell Rouse,Edmond O'Brien,Pamela Britton,Luther Adler
Terminator - Genisys,2015,Powell St at Geary St,null,T5 Productions LLC,Paramount Pictures,Alan Taylor,James Cameron,Arnold Schwarzenegger,Jason Clarke,null
Basic Instinct,1992,2104 Broadway,null,Carolco Pictures,TriStar Pictures,Paul Verhoeven,Joe Eszterhas,Michael Douglas,Sharon Stone,George Dzundza
Looking Season 2 ep 202,2015,Eddy @ Polk Street,null,"Mission Street Productions, LLC",HBO,Andrew Haigh,Michael Lannan,Jonathan Groff,Frankie Alvarez,Murray Bartlett
The Dead Pool,1988,23rd & Iowa Streets (Dogpatch),null,Warner Bros. Pictures,Warner Bros. Pictures,Buddy Van Horn,Harry Julian Fink,Clint Eastwood,Liam Neeson,Patricia Clarkson
Steve Jobs,2015,Davies Symphony Hall (201 Van Ness Ave.),null,RDF Productions LLC,Universal Pictures,Danny Boyle,Aaron Sorkin,Michael Fassbender,Kate Winslet,Seth Rogen
Bitter Melon,2018,66 Danton St,null,Bitter Melon Film LLC/Mammoth Pictures,"ABS-CBN, Gravitas Ventures",H.P. Mendoza,H.P. Mendoza,Jon Norman Schneider,Patrick Epino,Brian Rivera
Beautiful Boy,2018,Haight at Masonic,null,Big Indie Pictures,Amazon Studios,Felix van Groeningen,Luke Davies,Steve Carell,Timothee Chalamet,Maura Tierney
Pushing Dead,2016,"Ele Nino Traiing Cetner, 2920 3rd Street",null,"Pushing Dead , LLC",TBD,Tom Brown,Tom Brown,Danny Glover,James Roday,Robin Weigert
Edtv,1999,Mario's Bohemian Cigar Store (Washington Square),null,Imagine Entertainment,MCA / Universal Pictures,Ron Howard,Lowell Ganz,Matthew McConaughey,Jenna Elfman,null
A Taiwanese Tale of Two Cities,2018,Steiner St at Fulton St,null,Envision Productions Inc.,Netflix,Tien-Lun Yeh,"Ling-Hui Chen, Nancy Chen, Chih-Chi Fan, Chia-Hui Lin",Tammy Cheng,Peggy Tseng,Shen-Hao Wen
180,2011,Epic Roasthouse (399 Embarcadero),null,SPI Cinemas,null,Jayendra,"Umarji Anuradha, Jayendra, Aarthi Sriram, & Suba",Siddarth,Nithya Menon,Priya Anand
Parks and Recreation,2014,Filbert from Hyde to Leavenworth,null,"NBC Universal Media, LLC","NBC Universal Media, LLC",Dean Holland,Greg Daniels,Amy Poehler,null,null
Woman on the Run,1950,Former Hall of Justice (750 Kearny Street at Washington),null,Fidelity Pictures Corporation,Universal Pictures,Norman Foster,Norman Foster,Ann Sheridan,Dennis O'Keefe,Robert Keith
Summertime,2015,Duboce Park,null,"Creative Monster Productions, Inc.",13 Distribution,Gabriele Muccino,Gabriele Muccino,Jessica Rothe,Scott Bakula,Matilda Anna Ingrid Lutz
Looking,2014,The Café at 2369 Market St.,null,"Mission Street Productions, LLC",Home Box Office (HBO),Andrew Haigh,Michael Lannan,Jonathan Groff,Frankie J. Alvarez,Murray Bartlett
Time After Time,1979,Justin Herman Plaza,null,Orion Pictures Corp.,Columbia Broadcasting System (CBS),Nicholas Meyer,Karl Alexander,Malcolm McDowell,Mary Steenburgen,David Warner
Swingin' Along,1961,Powell Street,null,Twentieth Century Fox Film Corporation,Twentieth Century Fox Film Corporation,Charles Barton,Jameson Brewer,Tommy Noonan,Barbara Eden,Peter Marshall
Dirty Harry,1971,"Washington Square, North Beach",null,The Malpaso Company,Warner Brothers,Don Siegel,Harry Julian Fink,Clint Eastwood,Harry Guardino,null
Venom,2018,O'Farrell between Leavenworth and Jones,null,"L.O.Z. Productions, Inc.","Columbia Pictures, Sony Pictures Releasing",Ruben Fleischer,"Jeff Pinkner, Scott Rosenberg",Tom Hardy,Michelle Wiliams,Riz Ahmed
Forrest Gump,1994,Palace of Fine Arts (3301 Lyon Street),"The original Palace was built for the 1915 Panama-Pacific Exposition, and completely destroyed in 1964. It was rebuilt in 1965.",Paramount Pictures,Paramount Pictures,Robert Zemeckis,Eric Roth,Tom Hanks,Robin Wright,null
Boys and Girls,2000,City Hall,"The dome of SF's City Hall is almost a foot taller than that of the US Capitol Building. In 1954, Joe DiMaggio and Marilyn Monroe married at the Beaux Arts-style building.",Punch 21 Productions,Dimension Films,Robert Iscove,The Drews,"Freddie Prinze, Jr.",Alyson Hannigan,null
Joy Luck Club,1993,180 Manchester Street,null,Hollywood Pictures,National Broadcasting Company (NBC),Wayne Wang,Amy Tan,Kieu Chinh,Tsai Chin,France Nuyen
The Dead Pool,1988,"The Cannery (281 Leavenworth Street, Fisherman's Wharf)",null,Warner Bros. Pictures,Warner Bros. Pictures,Buddy Van Horn,Harry Julian Fink,Clint Eastwood,Liam Neeson,Patricia Clarkson
Sister Act 2: Back in the Habit,1993,"St. Peter & Paul's Church (666 Filbert Street, Washington Square)","Though Marilyn Monroe and Joe DiMaggio were not allowed to be married at the Church (DiMaggio had married his first wife at the Church but was divorced), the couple returned to the steps of the Church for photos, following their City Hall nuptials.",Touchstone Pictures,Buena Vista Pictures,Bill Duke,Joseph Howard,Whoopi Goldberg,Maggie Smith,null
Steve Jobs,2015,Castro St. between 21st an Hill St,null,RDF Productions LLC,Universal Pictures,Danny Boyle,Aaron Sorkin,Michael Fassbender,Kate Winslet,Seth Rogen
"Murder in the First, Season 3",2016,Civic Center Plaza,null,Turner North Center Productions,Turner Network Television (TNT),Steven Bochcho,Eric Lodal,Taye Diggs,Kathleen Robertson,Ian Anthony Dale
Point Blank,1967,Alcatraz Island,Alcatraz Island was a military fort before it became a prison.,Metro-Goldwyn Mayer,Metro-Goldwyn Mayer,John Boorman,Alexander Jacobs,Lee Marvin,Angie Dickinson,Keenan Wynn
Big Eyes,2014,Palace of Fine Arts,null,Blink & Wink Productions,Weinstein Company,Tim Burton,Scott Alexander,Amy Adams,Krysten Ritter,Christoph Waltz
Patch Adams,1998,Treasure Island,"An artificial island, Treasure Island was created for the 1939 Golden Gate International Exposition, and is named after the novel by Robert Louis Stevenson, a one-time San Francisco resident.",Bungalow 78 Productions,Universal Pictures,Tom Shadyac,Steve Oedekerk,Robin Williams,Philip Seymour Hoffman,null
Bullitt,1968,Bayshore Blvd near Cesar Chavez (Bayview),null,"Warner Brothers / Seven Arts
Seven Arts",Warner Brothers,Peter Yates,Alan R. Trustman,Steve McQueen,Jacqueline Bisset,Robert Vaughn
Dawn of the Planet of the Apes,2014,Columbus & Pacific Ave,null,"Fox Louisiana Productions, LLC",Twentieth Century Fox,Matt Reeves,Rick Jaffa,Gary Oldman,Keri Russell,Andy Serkis
Barbary Coast,1935,null,null,The Samuel Goldwyn Company,United Artists,Howard Hawks,Ben Hecht,Mariam Hopkins,Edward G. Robinson,Joel McCrea
The Maltese Falcon,1941,Golden Gate Bridge,"With 23 miles of ladders and 300,000 rivets in each tower, the Golden Gate Bridge was the world's longest span when it opened in 1937.",Warner Bros. Pictures,Warner Bros. Pictures,John Huston,John Huston,Humphrey Bogart,Mary Astor,Gladys George
Getting Even with Dad,1994,"St. Peter & Paul's Church (666 Filbert Street, Washington Square)","Though Marilyn Monroe and Joe DiMaggio were not allowed to be married at the Church (DiMaggio had married his first wife at the Church but was divorced), the couple returned to the steps of the Church for photos, following their City Hall nuptials.",Metro-Goldwyn-Mayer (MGM),Metro-Goldwyn-Mayer (MGM),Howard Deutch,Tom S. Parker,Macaulay Culkin,Ted Danson,null
When We Rise,2017,520 Castro St.,null,Film 49 Productions,Amercian Broadcasting Company,Gus Van Sant,Dustin Lance Black,Guy Pierce,Mary-Louise Parker,Michael Kenneth Williams
A Taiwanese Tale of Two Cities,2018,Dolores Park,null,Envision Productions Inc.,Netflix,Tien-Lun Yeh,"Ling-Hui Chen, Nancy Chen, Chih-Chi Fan, Chia-Hui Lin",Tammy Cheng,Peggy Tseng,Shen-Hao Wen
A Night Full of Rain,1978,"Fairmont Hotel (950 Mason Street, Nob Hill)","In 1945 the Fairmont hosted the United Nations Conference on International Organization as delegates arrived to draft a charter for the organization. The U.S. Secretary of State, Edward Stettinius drafted the charter in the hotel's Garden Room.",Liberty Film,Warner Bros. Pictures,Lina Wertmuller,Lina Wertmuller,Candice Bergen,Giancarlo Gianni,null
Godzilla,2014,Embarcadero & Washington,null,"Nautilus Productions, LLC",Warner Bros. Pictures,Gareth Edwards,Max Borenstein,Aaron Taylor-Johnson,Elizabeth Olsen,Bryan Cranston
Birdman of Alcatraz,1962,Pier 43 1/2,null,Norma Productions,United Artists,John Frankenheimer,Guy Trosper,Burt Lancaster,Karl Maden,Thelma Ritter
Looking Season 2 ep 203,2015,"Willy's Barber shop, 3227 22nd Street",null,"Mission Street Productions, LLC",HBO,Andrew Haigh,Michael Lannan,Jonathan Groff,Frankie Alvarez,Murray Bartlett
Foul Play,1978,Sacramento & Hyde Streets (Nob Hill),null,Paramount Pictures,Paramount Pictures,Colin Higgins,Colin Higgins,Goldie Hawn,Chevy Chase,Burgess Meredith
Always Be My Maybe,2019,22nd Ave Home,null,"Isla Productions, LLC",Netflix,Nahnatchka Khan,"Michael Golamco, Randall Park, Ali Wong",Ali Wong,Randall Park,Keanu Reeves
Terminator - Genisys,2015,"Mission St., Embarcadero, and Front between Clay and Market",null,T5 Productions LLC,Paramount Pictures,Alan Taylor,James Cameron,Arnold Schwarzenegger,Jason Clarke,null
Bitter Melon,2018,68 Dublin St,null,Bitter Melon Film LLC/Mammoth Pictures,"ABS-CBN, Gravitas Ventures",H.P. Mendoza,H.P. Mendoza,Jon Norman Schneider,Patrick Epino,Brian Rivera
Ant-Man,2015,California between Kearney and Davis,Driving shots,"PYM Particles Productions, LLC",Walt Disney Studios Motion Pictures,Peyton Reed,Gabriel Ferrari,Michael Douglas,Paul Rudd,null
Maxie,1985,"Asian Art Museum (200 Larkin Street, Civic Center)",The Dalai Lama opened an exhibition on Wisdom and Compassion at the museum in 1991.,Elsboy Entertainment,Orion Pictures Corporation,Paul Aaron,Patricia Resnick,Glenn Close,Mandy Patinkin,Ruth Gordon
Venom,2018,"Epic Steakhouse, 369 Embarcadero",null,"L.O.Z. Productions, Inc.","Columbia Pictures, Sony Pictures Releasing",Ruben Fleischer,"Jeff Pinkner, Scott Rosenberg",Tom Hardy,Michelle Wiliams,Riz Ahmed
Chance- Season 1 ep103,2016,"The Drew School, 2901 California",null,TVM Productions,HULU,Michael Lehmann,Kem Nunn,Hugh Laurie,Gretchen Mol,Ethan Suplee
The Last Black Man in San Francisco,2019,415 Lyon St/355 Lyon St,null,"LBMISF, LLC",A56,Joe Talbot,"Joe Talbot, Jimmie Fails, Rob Richert",Jimmie Fails,Jonathan Majors,Danny Glover
Boys and Girls,2000,Lombard Street,Lombard Street is not actually the most crooked in SF. That honor goes to Potrero Hill's Vermont Street between 22nd and 23rd.,Punch 21 Productions,Dimension Films,Robert Iscove,The Drews,"Freddie Prinze, Jr.",Alyson Hannigan,null
The Woman In Red,1984,Palace of Fine Arts (3301 Lyon Street),"The original Palace was built for the 1915 Panama-Pacific Exposition, and completely destroyed in 1964. It was rebuilt in 1965.",Orion Pictures Corp.,MGM Home Entertainment,Gene Wilder,Jean Loup Dabadie & Yves Robert,Gene Wilder,Charles Grodin,null
Knife Fight,2013,City Hall,null,Divisadero Pictures & Knife Fight,Eagle Films,Bill Guttentag,Bill Guttentag & Chris Lehane,Rob Lowe,Julie Bowen,Jamie Chung
Vertigo,1958,Brocklebank Apartments (1000 Mason Street),null,Alfred J. Hitchcock Productions,Paramount Pictures,Alfred Hitchcock,Alec Coppel,James Stewart,Kim Novak,Barbara Bel Geddes
Alexander's Ragtime Band,1938,Cliff House (1090 Point Lobos Avenue),"In 1887, the Cliff House was severely damaged when the schooner Parallel, abandoned and loaded with dynamite, ran aground on the rocks below.",Twentieth Century Fox Film Corporation,Twentieth Century Fox Film Corporation,Henry King,Kathryn Scola,Tyrone Power,Alice Faye,Don Ameche
The Princess Diaries,2001,Fisherman's Wharf,"Supposedly, Mikhail S. Gorbachev has said that his favorite part of visiting America was touring Fisherman's Wharf.",Walt Disney Pictures,Buena Vista Pictures,Garry Marshall,Gina Wendkos,Julie Andrews,Anne Hathway,null
"Murder in the First, Season 3",2016,Howard Street at Steuart Street,null,Turner North Center Productions,Turner Network Television (TNT),Steven Bochcho,Eric Lodal,Taye Diggs,Kathleen Robertson,Ian Anthony Dale
The OA Part II,2019,Washington btwn Gough and Octavia St,null,Lunar Mining LLC,Netflix,Zal Batmanglij,"Zal Batmanglij, Brit Marling",Brit Marling,Emory Cohen,Patrick Gibson
180,2011,Polk & Larkin Streets,null,SPI Cinemas,null,Jayendra,"Umarji Anuradha, Jayendra, Aarthi Sriram, & Suba",Siddarth,Nithya Menon,Priya Anand
Chance- Season 1 ep109,2016,60 Leavenworth St.,null,TVM Productions,HULU,Sara Gran and Pete Begler,Dan Attias,Hugh Laurie,Gretchen Mol,Ethan Suplee
Fearless,1993,Kohl Building (400 Montgomery Street),null,Spring Creek Productions,Warner Bros. Pictures,Peter Weir,Rafael Yglesias,Jeff Bridges,Isabella Rosellini,Rosie Perez
"Smile Again, Jenny Lee",2015,Mission Inn (5630 Mission St),null,Carlo Caldana/Marguery Films,null,Carlo Caldana,Linda Demetrick,Craig Tsuyumine,Puneet Prasad,Larry Kitagawa
I Am Michael,2015,"Grove & Polk, thru Fulton & 6th, Masonic, 28th & 47th",null,That’s Hollywood,null,Justin Kelly,Justin Kelly,James Franco,Emma Roberts,Zachary Quinto
George of the Jungle,1997,"Neiman Marcus (150 Stockton Street, Union Square)",The City of Paris department store previously occupied the space that now houses Neiman Marcus. City of Paris' original rotunda and glass dome were incorporated into Neiman Marcus' design.,Walt Disney Pictures,Buena Vista Pictures,Sam Weisman,Jay Ward,Brendan Fraser,Leslie Mann,null
Vertigo,1958,Claude Lane at Bush Street,null,Alfred J. Hitchcock Productions,Paramount Pictures,Alfred Hitchcock,Alec Coppel,James Stewart,Kim Novak,Barbara Bel Geddes
Looking,2014,Treasure Island,null,"Mission Street Productions, LLC",Home Box Office (HBO),Andrew Haigh,Michael Lannan,Jonathan Groff,Frankie J. Alvarez,Murray Bartlett
The Last Black Man in San Francisco,2019,Mission btwn 16th and Cesar Chavez,null,"LBMISF, LLC",A29,Joe Talbot,"Joe Talbot, Jimmie Fails, Rob Richert",Jimmie Fails,Jonathan Majors,Danny Glover
Foul Play,1978,Golden Gate & Steiner Streets (Hayes Valley),null,Paramount Pictures,Paramount Pictures,Colin Higgins,Colin Higgins,Goldie Hawn,Chevy Chase,Burgess Meredith
Birth of the Dragon,2016,California at Mason,null,"BOTD U.S. Productions, Inc.",Kylin Pictures,George Nolfi,"Christopher Wilkinson, Stephen J. Rivele",Philip Ng,Billy Magnussen,Yu Xia
Quitters,2015,Yerba Buena Gardens,null,"Frederick & Ashbury, LLC.",null,Noah Pritzker,Noah Pritzker,Kara Hayward,Mira Sorvino,Saffron Burrows
Terminator - Genisys,2015,California at Larkin,null,T5 Productions LLC,Paramount Pictures,Alan Taylor,James Cameron,Arnold Schwarzenegger,Jason Clarke,null
Panther,1995,null,null,Gramercy Pictures,PolyGram Video,Mario Van Peebles,Mario Van Peebles,Kadeem Hardison,Bookeem Woodbine,null
Foul Play,1978,City Hall,"The dome of SF's City Hall is almost a foot taller than that of the US Capitol Building. In 1954, Joe DiMaggio and Marilyn Monroe married at the Beaux Arts-style building.",Paramount Pictures,Paramount Pictures,Colin Higgins,Colin Higgins,Goldie Hawn,Chevy Chase,Burgess Meredith
The Dead Pool,1988,"KGO-TV ABC7 TV Studios (900 Front Street, Waterfront Historic District)",null,Warner Bros. Pictures,Warner Bros. Pictures,Buddy Van Horn,Harry Julian Fink,Clint Eastwood,Liam Neeson,Patricia Clarkson
Looking,2014,770 Haight St,null,"Mission Street Productions, LLC",Home Box Office (HBO),Andrew Haigh,Michael Lannan,Jonathan Groff,Frankie J. Alvarez,Murray Bartlett
Chance Season 2,2017,Market St at Embarcadero,null,TVM Productions Inc.,Hulu,Rozann Dawson,Alexandra Cunningham,Hugh Laurie,Greta Lee,Ethan Suplee
Godzilla,2014,Bush & Kearny,null,"Nautilus Productions, LLC",Warner Bros. Pictures,Gareth Edwards,Max Borenstein,Aaron Taylor-Johnson,Elizabeth Olsen,Bryan Cranston
Terminator - Genisys,2015,San Francisco - Oakland Bay Bridge,null,T5 Productions LLC,Paramount Pictures,Alan Taylor,James Cameron,Arnold Schwarzenegger,Jason Clarke,null
"Murder in the First, Season 1",2014,Hall of Justice (850 Bryant Street),null,Turner North Center Productions,Turner Network Television (TNT),Steven Bochcho,Eric Lodal,Taye Diggs,Kathleen Robertson,Ian Anthony Dale
Alcatraz,2012,Broadway from Mason to Taylor,null,Bonanza Productions Inc.,Warner Bros. Television,J.J. Abrams,Steven Lilien,Sarah Jones,Jorge Garcia,null
Sense8 - Season 2,2016,"San Francisco City Hall, 1 Dr. Carlton B. Goodlett Pl.","Many films have shot scene in and around the building including Raiders of the Lost Ark, Invasion of the Body Snatchers, Dirty Harry, The Towering Inferno, A View to a Kill and most recently, Milk. The Christmas party scene for this show was shot in the Rotunda.","Unpronounceable Productions, LLC",Netflix,Wachowski Siblings,"J. Michael Straczynski, Wachowiski Siblings",Jamie Clayton,Daryl Hannah,Naveen Andrews
